PMID,Journal,Year,Month,Day,Title,Publication Type,Authors,Abstract,s1,s2,s3,r1,r2,r3
30833489,The oncologist,2019,Sep,,"First-in-Human Phase I Study of Merestinib, an Oral Multikinase Inhibitor, in Patients with Advanced Cancer.","Clinical Trial, Phase I, Journal Article, Research Support, Non-U.S. Gov't","Aiwu Ruth He, Roger B Cohen, Crystal S Denlinger, Ashwin Sama, Ariel Birnbaum, Jimmy Hwang, Takami Sato, Nancy Lewis, Michelle Mynderse, Michele Niland, Jennifer Giles, Johan Wallin, Brian Moser, Wei Zhang, Richard Walgren, Elizabeth R Plimack","The purpose of this nonrandomized, open-label, phase I study (NCT01285037) was to evaluate the safety and tolerability of merestinib, an oral antiproliferative and antiangiogenic kinase inhibitor, and to determine a recommended phase II dose and schedule for patients with advanced cancer.
This was a multicenter, nonrandomized, open-label, phase I study of oral merestinib consisting of six parts: dose escalation (part A), followed by a four-cohort dose-confirmation study (part B) and subsequently a four-part dose expansion and combination safety testing of merestinib with standard doses of cetuximab (part C), cisplatin (part D), gemcitabine and cisplatin (part E), and ramucirumab (part F) in patients with specific types of advanced cancers. Safety, tolerability, antitumor activity, and pharmacokinetics were evaluated in all cohorts.
The dose escalation, confirmation, and expansion results support the dosing of merestinib at 120 mg once daily, based on acceptable exposure and safety at this dose. One complete response was observed in a patient with cholangiocarcinoma, and three patients with cholangiocarcinoma achieved a partial response. Overall, 60 (32%) of the 186 patients enrolled in the study had a best response of stable disease.
This study demonstrates that merestinib has a tolerable safety profile and potential anticancer activity and warrants further clinical investigation.
Merestinib treatment in patients with advanced cancer demonstrated an acceptable safety profile and potential antitumor activity, supporting its future development in specific disease populations as a monotherapy and/or in combination with other therapies.",-1,1,1,"The study focuses on patients with advanced cancer, including cholangiocarcinoma, but not specifically on colorectal cancer.",The study includes a part (part F) that evaluates merestinib in combination with ramucirumab in patients with specific types of advanced cancers.,"The study describes the safety and tolerability of ramucirumab when used in combination with merestinib, indicating an effect of ramucirumab treatment."
37584156,"Future oncology (London, England)",2023,Jul,,Phase II biomarker identification study of anti-VEGF agents with FOLFIRI for pretreated metastatic colorectal cancer.,"Journal Article, Clinical Trial Protocol","Tadayoshi Hashimoto, Satoshi Otsu, Shuichi Hironaka, Atsuo Takashima, Junki Mizusawa, Tomoko Kataoka, Haruhiko Fukuda, Shunsuke Tsukamoto, Tetsuya Hamaguchi, Yukihide Kanemitsu","Chemotherapy plus antiangiogenic agents, including bevacizumab, ramucirumab and aflibercept, is a standard second-line treatment for patients with metastatic colorectal cancer, but which specific agents should be selected is ambiguous due to a lack of clear evidence from prospective studies. Previous reports have suggested ramucirumab and aflibercept could be more effective than bevacizumab in patients with high VEGF-D and high VEGF-A, respectively. JCOG2004 is a three-arm, randomized, phase II study to identify predictive biomarkers for these agents in patients who have failed first-line treatment. The study will enroll 345 patients from 52 institutions for 2 years, with progression-free survival in high VEGF-D (bevacizumab vs ramucirumab) and high VEGF-A (bevacizumab vs aflibercept) serving as the primary end point. Clinical Trial Registration: jRCTs031220058 (www.jrct.niph.go.jp).",1,1,0,The study focuses on patients with metastatic colorectal cancer.,The study examines the use of Ramucirumab in comparison with bevacizumab in patients with high VEGF-D.,"The study describes the effect of Ramucirumab treatment in terms of progression-free survival as a primary endpoint, but the specific results or detailed effect measures are not provided in the given paper content."
32132063,Anticancer research,2020,Mar,,Risk Benefit of FOLFIRI Plus Ramucirumab as Third-line and Later-line Treatment of Metastatic Colorectal Cancer.,Journal Article,"Michio Kimura, Eiseki Usami, Hitomi Teramachi, Tomoaki Yoshimura","The aim of this study was to clarify the risk benefits of folinic acid, fluorouracil, and irinotecan (FOLFIRI) plus ramucirumab (F-RAM) as third-line and later-line treatment for metastatic colorectal cancer (mCRC).
We compared the overall survival (OS), adverse events (AEs), and cost of F-RAM to those of trifluridine/tipiracil combination tablet (TAS-102).
There was no significant difference in the median OS [6.1 (range=1.2-16.3) months vs. 6.1 (range=1.2-22.3) months; log-rank test, p=0.272] and treatment duration [4.0 (range=1.2-9.6) months vs. 3.5 (range=0.2-12.3) months, p=0.888] between the F-RAM (n=13) and the TAS-102 (n=36) groups. However, AEs were more frequent in the F-RAM group, and 1-year administration of F-RAM cost higher ($81,724.8 vs. $18,931.4, p<0.001).
F-RAM as third-line and later-line treatment for mCRC has a poor risk benefit. TAS-102 should be given priority over F-RAM.",1,1,1,The study focuses on patients with metastatic colorectal cancer (mCRC).,The study examines the use of Ramucirumab in combination with FOLFIRI as a treatment for mCRC.,"The study describes the effect of Ramucirumab treatment, including outcomes such as overall survival, adverse events, and cost."
35288017,Journal of the Formosan Medical Association = Taiwan yi zhi,2022,Oct,,Ramucirumab plus triplet chemotherapy as an alternative salvage treatment for patients with metastatic colorectal cancer.,Journal Article,"Yi-Hsin Liang, Jin-Tung Liang, Ben-Ren Lin, John Huang, Ji-Shiang Hung, Shuo-Lun Lai, Tzu-Chun Chen, Jia-Huei Tsai, Yung-Ming Cheng, Ting-Han Tsao, Wen-Ling Hsu, Kuo-Hsing Chen, Kun-Huei Yeh","Ramucirumab is indicated for salvage treatment after failure of first-line treatment for metastatic colorectal cancer (mCRC). However, the application of ramucirumab at later-line treatment in real-world practice has not received much discussion.
In this retrospective study, we enrolled 70 patients with mCRC who received ramucirumab plus chemotherapy at National Taiwan University Hospital between 2018 and 2019.
Compared with those who received third- or later-line ramucirumab treatment, patients who received second-line ramucirumab treatment had significantly longer median time to treatment discontinuation (mTTD; 6.7 vs 3.6 months, P = .004) and median overall survival (mOS; not reached vs 7.6 months, P = .009). Multivariate analyses revealed that second-line ramucirumab and triplet chemotherapy backbone were the only independent predictive factors for long mTTD and mOS. Patients who received ramucirumab with triplet chemotherapy had a significantly longer mOS than did patients who received ramucirumab with doublet chemotherapy (not reached vs 5.6 months, P = .002). Among those receiving second-line ramucirumab treatment, combination with triplet chemotherapy led to a longer mTTD than did combination with doublet chemotherapy, but the difference was non-significant (not reached vs 4.4 months, P = .108). By contrast, in patients receiving fourth- or later-line ramucirumab, combination with triplet chemotherapy led to significantly longer mTTD than did combination with doublet chemotherapy (8.0 vs 2.9 months, P = .032).
Ramucirumab plus triplet chemotherapy may be an alternative regimen in patients with mCRC, particularly as a later-line treatment modality.",1,1,1,The study focuses on patients with metastatic colorectal cancer (mCRC).,The study examines the use of Ramucirumab in combination with chemotherapy as a treatment for mCRC.,"The study describes the effect of Ramucirumab treatment, including its impact on time to treatment discontinuation and overall survival."
36582117,Expert opinion on drug metabolism & toxicology,2022,Nov,,Pharmacokinetics and pharmacodynamics of approved monoclonal antibody therapy for colorectal cancer.,"Review, Journal Article","Nadia Saoudi Gonzalez, Daniel López, Diego Gómez, Javier Ros, Iosune Baraibar, Francesc Salva, Josep Tabernero, Elena Élez","The introduction of monoclonal antibodies to the chemotherapy backbone treatment has challenged the paradigm of metastatic colorectal cancer (mCRC) treatment. Their mechanism of action and pharmacokinetics are complex but important to understand in order to improve patient selection and treatment outcomes for mCRC population.
This review examines the scientific data, pharmacodynamics, and pharmacokinetics of approved monoclonal antibodies used to treat mCRC patients, including agents targeting signaling via VEGFR (bevacizumab and ramucirumab), EGFR (cetuximab and panitumumab), HER2/3 target therapy, and immunotherapy agents such as pembrolizumab or nivolumab. Efficacy and mechanism of action of bispecific antibodies are also covered.
mCRC is a heterogeneous disease and the optimal selection and sequence of treatments is challenging. Monoclonal antibodies have complex pharmacokinetics and pharmacodynamics, with important interactions between them. The arrival of bioequivalent molecules to the market increases the need for the characterization of pharmacokinetics and pharmacodynamics of classic monoclonal antibodies to reach bioequivalent novel molecules.",1,1,0,The paper explicitly mentions patients with metastatic colorectal cancer (mCRC).,The paper discusses ramucirumab as one of the monoclonal antibodies used in the treatment of mCRC.,The paper provides an overview of pharmacokinetics and pharmacodynamics of ramucirumab but does not specifically describe the effect of ramucirumab treatment in detail.
34139727,Gan to kagaku ryoho. Cancer & chemotherapy,2021,Jun,,[FOLFIRI plus Ramucirumab Treatment for Metastatic Colorectal Cancer-Narrative Review of Real-World Evidence in Japan].,"Journal Article, Review","Long Jin, Yoshinori Tanizawa, Eiji Shinozaki","To assess the efficacy and safety of ramucirumab in combination with FOLFIRI in patients with unresectable metastatic colorectal cancer under clinical practice in Japan, we reviewed manuscripts reporting clinical research, including case reports, of Japanese patients with FOLFIRI plus ramucirumab therapy published starting from 2016, when ramucirumab was approved as a treatment for metastatic colorectal cancer in Japan, to June 2020. We also reviewed an interim report of post-marketing surveillance study. The efficacy of ramucirumab in combination with FOLFIRI including irinotecan 150 mg/m2, which is the recommended dose in Japan and is used as initial dose in Japanese clinical practice, was similar to that of the global, phase 3 RAISE study with irinotecan 180 mg/m2. The desirable effect of FOLFIRI plus ramucirumab was observed in patients with wild-type RAS, primary tumors on the left sides(descending, sigmoid, or rectum colons), or who received anti-epidermal growth factor receptor agents, including panitumumab or cetuximab, as previous treatment. Also, the effectiveness of FOLFIRI plus ramucirumab as a late-line treatment was suggested. Several patients were reported to have nephrosis syndrome after starting ramucirumab, but they recovered with discontinuation of ramucirumab and appropriate treatment. No new safety concerns were observed from the literature or the interim report of post-marketing surveillance study.",1,1,1,The paper focuses on patients with metastatic colorectal cancer.,The paper examines the use and efficacy of ramucirumab in combination with FOLFIRI.,"The paper describes the effect of ramucirumab treatment, including its efficacy and safety profile."
31065729,Cancer chemotherapy and pharmacology,2019,Aug,,Second-line FOLFIRI plus ramucirumab with or without prior bevacizumab for patients with metastatic colorectal cancer.,Journal Article,"Takeshi Suzuki, Eiji Shinozaki, Hiroki Osumi, Izuma Nakayama, Yumiko Ota, Takashi Ichimura, Mariko Ogura, Takeru Wakatsuki, Akira Ooki, Daisuke Takahari, Mitsukuni Suenaga, Keisho Chin, Kensei Yamaguchi","Few data of folinic acid, fluorouracil, and irinotecan (FOLFIRI) plus ramucirumab (RAM) obtained in bevacizumab-naïve patients in clinical trials or routine clinical practice are available. The purpose of this retrospective study was to report the results of FOLFIRI plus RAM treatment as second-line chemotherapy for metastatic colorectal cancer (mCRC).
Seventy-four patients with mCRC who received second-line FOLFIRI + RAM mCRC therapy were stratified by previous first-line therapy to groups that had (PB) or had not (NPB) been given bevacizumab. The overall survival (OS), progression-free survival (PFS), and objective response were evaluated.
The overall median PFS was 6.2 months (95% CI 4.6-9.3) and median OS was 17.0 months (95% CI 11.6-NA). Median PFS was 8.0 months (95% CI 4.9-11.2) in NPB patients and 5.0 months (95% CI 3.1-7.3) in PB patients (hazard ratio = 0.72, 95% CI 0.40-1.30, p = 0.28). The response rates were 23% and 3% in NPB and PB patients, respectively. The disease control rates were 85% and 69% in NPB and PB patients, respectively.
The effectiveness of FOLFIRI + RAM as a second-line chemotherapy in patients with mCRC was in line with that reported in the previous RAISE phase III trial. The response was better in bevacizumab-naïve patients than those with first-line treatment that had included bevacizumab.",1,1,1,The study focuses on patients with metastatic colorectal cancer (mCRC).,The study examines the use of Ramucirumab in combination with FOLFIRI as second-line treatment.,"The study describes the effect of Ramucirumab treatment, including outcomes such as PFS, OS, response rates, and disease control rates."
36439491,Frontiers in oncology,2022,,,"Study protocol for HGCSG1801: A multicenter, prospective, phase II trial of second-line FOLFIRI plus aflibercept in patients with metastatic colorectal cancer refractory to anti-EGFR antibodies.",Journal Article,"Hiroshi Nakatsumi, Yoshito Komatsu, Tetsuhito Muranaka, Satoshi Yuki, Yasuyuki Kawamoto, Kazuaki Harada, Masayoshi Dazai, Miki Tateyama, Yusuke Sasaki, Takuto Miyagishima, Yasushi Tsuji, Masaki Katagiri, Michio Nakamura, Susumu Sogabe, Kazuteru Hatanaka, Takashi Meguro, Tomoe Kobayashi, Atsushi Ishiguro, Osamu Muto, Yoshiaki Shindo, Masahito Kotaka, Takayuki Ando, Ryo Takagi, Naoya Sakamoto, Yu Sakata","The first-line chemotherapy for patients with RAS and BRAF wild-type metastatic colorectal cancer (mCRC) commonly involves cytotoxic regimens, such as FOLFOX and FOLFIRI, combined with epidermal growth factor receptor (EGFR) antibodies. When progression occurs following anti-EGFR antibody-combined chemotherapy, anti-angiogenic inhibitors can be used as second-line treatment. Although randomized controlled trials have shown that anti-angiogenic inhibitors [bevacizumab, ramucirumab, and aflibercept (AFL)] carry survival benefit when combined with FOLFIRI as second-line chemotherapy, such trials did not provide data on patients with mCRC refractory to anti-EGFR antibody-combined chemotherapy. Therefore, our group planned a multicenter, nonrandomized, single-arm, prospective, phase II study to investigate the safety and efficacy of FOLFIRI plus AFL as a second-line chemotherapy for patients with mCRC refractory to oxaliplatin-based chemotherapy combined with anti-EGFR antibodies.
FOLFIRI (irinotecan 180 mg/m2, l-leucovorin 200 mg/m2, bolus 5-FU 400 mg/m2, and infusional 5-FU 2400 mg/m2/46 h) and AFL (4 mg/kg) will be administered every 2 weeks until progression or unacceptable toxicities occur. The primary endpoint will be the 6-month progression-free survival (PFS) rate, whereas the secondary endpoints will include overall survival, PFS, response rate, disease control rate, adverse events, and relative dose intensity for each drug. A sample size of 41 participants will be required. This study will be sponsored by the Non-Profit Organization Hokkaido Gastrointestinal Cancer Study Group and will be supported by a grant from Sanofi.
There is only an observational study reporting data on FOLFIRI plus AFL for patients with mCRC who previously received anti-EGFR antibodies; therefore, a prospective clinical trial is needed. This study will prospectively evaluate the efficacy and safety of FOLFIRI plus AFL in patients with mCRC who are resistant to anti-EGFR antibodies and have limited data. Moreover, this study will reveal predictive biomarkers for AFL-based chemotherapy.
Japan Registry of Clinical Trials, jRCTs011190006. Registered 19 November, 2019, https://jrct.niph.go.jp/latest-detail/jRCTs011190006.",1,-1,0,The study focuses on patients with metastatic colorectal cancer (mCRC).,"The study examines the use of aflibercept, not ramucirumab, as the anti-angiogenic agent in combination with FOLFIRI.","The study does not describe the effect of ramucirumab treatment, as it is not part of the intervention being evaluated."
33508242,The lancet. Gastroenterology & hepatology,2021,Mar,,"Safety and activity of trifluridine/tipiracil and ramucirumab in previously treated advanced gastric cancer: an open-label, single-arm, phase 2 trial.","Clinical Trial, Phase II, Journal Article, Research Support, Non-U.S. Gov't","Akihito Kawazoe, Takayuki Ando, Hisashi Hosaka, Junya Fujita, Keisuke Koeda, Kazuhiro Nishikawa, Kenji Amagai, Kazumasa Fujitani, Kazuhiro Ogata, Keita Watanabe, Yuji Yamamoto, Kohei Shitara","Findings of preclinical and clinical trials in colorectal cancer have shown promising antitumour effects of the co-formulation trifluridine/tipiracil and VEGF inhibition. We aimed to investigate the safety and activity of trifluridine/tipiracil and ramucirumab for previously treated advanced gastric cancer.
We did an open-label, single-arm, two-cohort, phase 2 study at eight centres in Japan. We enrolled patients with unresectable advanced gastric cancer or gastro-oesophageal junction adenocarcinoma. Cohort A included patients previously treated with one line of chemotherapy without ramucirumab and cohort B included patients previously treated with two to four lines of chemotherapy, including ramucirumab. Patients received trifluridine/tipiracil (35 mg/m2) orally twice daily on days 1-5 and days 8-12 of each 28-day treatment cycle, plus intravenous ramucirumab (8 mg/kg) on days 1 and 15. The primary endpoint was the disease control rate, assessed by investigators and defined as the proportion of patients with a confirmed best overall response, according to Response Evaluation Criteria in Solid Tumors version 1.1. This trial is registered on JapicCTI (JapicCTI-194596) and is ongoing but not recruiting.
Between April 8 and Oct 11, 2019, 64 patients were enrolled and included in the safety and activity analyses, 33 in cohort A and 31 in cohort B. In cohort A, the disease control rate was 85% (95% CI 68-95; 28 of 33 patients) and in cohort B it was 77% (59-90; 24 of 31 patients). Common treatment-related adverse events of grade 3 or worse were neutrophil count decreased (27 [82%] in cohort A and 23 [74%] in cohort B), white blood cell count decreased (eight [24%] and seven [23%]), and platelet count decreased (eight [24%] and four [13%]). Serious treatment-related adverse events were recorded in three patients in cohort A (fatigue and neutrophil count decreased; large intestine perforation; and febrile neutropenia, platelet count decreased, and anaemia). No patients in cohort B had a serious treatment-related adverse event, and no treatment-related deaths were reported in either cohort.
Trifluridine/tipiracil and ramucirumab showed an acceptable safety profile and clinical activity in patients with previously treated advanced gastric cancer regardless of previous ramucirumab exposure.
Taiho Pharmaceutical and Eli Lilly.",-1,1,1,"The study focuses on patients with advanced gastric cancer, not colorectal cancer.",The study examines the use of Ramucirumab in combination with trifluridine/tipiracil as a treatment for advanced gastric cancer.,"The study describes the effect of Ramucirumab treatment, including its safety profile and clinical activity in patients with previously treated advanced gastric cancer."
34910154,JAMA network open,2021,Dec,01,Comparative Effectiveness of Biologic Agents Among Black and White Medicare Patients in the US With Metastatic Colorectal Cancer.,"Comparative Study, Journal Article, Research Support, N.I.H., Extramural","Sanjay Goel, Abdissa Negassa, Ana Acuna-Villaorduna","Randomized clinical trials have defined the survival benefit provided by the addition of biologic drugs to chemotherapy in patients with metastatic colorectal cancer (mCRC). However, Black patients may be underrepresented in trial populations, and outcomes in this group remain poorly defined.
To determine whether the real-world benefit of biologic drugs in Black patients is consistent with the real-world benefit of biologic drugs in White patients using a comparative effectiveness research approach.
Population-based retrospective comparative effectiveness analysis of a cohort of patients aged 65 years or older with mCRC diagnosed between 2004 and 2011 who had received at least 1 dose of chemotherapy and had complete Medicare claims data using the Surveillance, Epidemiology, and End Result (SEER)-Medicare linked database. Data were analyzed from August 1, 2020, to March 31, 2021.
Patient data were classified according to whether patients received chemotherapy (oxaliplatin, irinotecan, and 5-fluorouracil or capecitabine) or biochemotherapy (bevacizumab, cetuximab, panitumumab, ramucirumab, or aflibercept, started within 3 months of chemotherapy).
Overall survival (OS) defined as the time from starting chemotherapy to death or last follow-up. A weighted Cox regression model was used to assess differences in survival.
A total of 5617 patients with mCRC were identified in the SEER-Medicare linked database, and 4542 patients were included in the main analysis. Of the 5617 patients, 3969 (70.7%) received biologic agents at any point between 2004 and 2011; biologic agent therapy was started within 3 months of chemotherapy in 2894 patients (72.9%). Among 4542 patients with data on race and ethnicity, the median age was 72 years (IQR, 68-78 years), 2365 (52.0%) were female, 3445 (75.8%) had colon as the primary site, 552 (12.2%) were Black patients, and 3990 (87.8%) were White patients. There was no difference in the receipt of 1 (76.7% and 74.8%) vs 2 or more (23.3% and 25.2%: P = .92) lines of therapy, and in the receipt of biologic agents (63.6% vs 64.3% P = .33), among White patients and Black patients, respectively. Biochemotherapy was associated with a significant survival benefit compared with chemotherapy alone in the overall population (biochemotherapy median OS, 17.9 [95% CI, 17.3-18.7] months vs chemotherapy median OS, 8.3 [95% CI, 9.1-9.9] months; P < .001). The survival benefit was similar among White patients (17.8 vs 9 months; average hazard ratio, 0.59; 95% CI, 0.55-0.64; P < .001) and Black patients (18.6 vs 9.9; average hazard ratio, 0.58; 95% CI, 0.47-0.71; P < .001).
In this comparative effectiveness analysis of a cohort of Medicare recipients with mCRC, biochemotherapy was associated with an improvement in OS with a similar rate of reduction in mortality among Black and White patients. Clinicians may offer biochemotherapy therapy to all patients to maximize clinical benefit, factoring in clinical variables, but not their race.",1,-1,0,The study focuses on patients with metastatic colorectal cancer (mCRC).,"The study does not specifically examine the use or effect of Ramucirumab; it refers to biologic agents in general, including Ramucirumab, but does not isolate its use or effect.","The study does not describe the specific effect of Ramucirumab treatment; it reports overall survival benefits of biochemotherapy, which includes multiple agents, but not Ramucirumab specifically."
