PMID,Journal,Year,Month,Day,Title,Publication Type,Authors,Abstract,s1,s2,s3,r1,r2,r3
31748484,Gan to kagaku ryoho. Cancer & chemotherapy,2019,Nov,,[Urine Protein/Creatinine Ratio Measurement Is Useful to Continue Anti-Angiogenic Agent Treatment].,Journal Article,"Yasumasa Saito, Kazuo Kitagawa, Junya Sato, Hidemi Yamamoto, Michiaki Watanabe, Masataka Masubuchi","Aside effect of anti-angiogenic agent treatment is proteinuria. Evaluation of the severity of adverse effects and the decision to discontinue treatment is based on the qualitative analysis of urinary proteins. However, a qualitative analysis result may not be indicative of the actual amounts of protein excreted. In this study, we evaluated the possibility of using the urine protein/creatinine ratio(UPCR), instead of a qualitative urine analysis, to monitor patients treated with antiangiogenic agents.
Urinalysis data of patients receiving anti-angiogenic agents-bevacizumab, ramucirumab, or aflibercept-were retrospectively analyzed from clinical records. Acorrelation between the urine protein content(qualitative and quantitative analyses)and continuity of anti-angiogenic agent treatment was evaluated.
Atotal of 24 patients (age, 70.83±7.45 years)who received treatment for colorectal cancer(n=17), lung cancer(n=4), gastric cancer(n=2), and breast cancer(n=1)were included. One hundred and sixty-five urinalysis results were collected. Alinear correlation between the qualitative urinalysis results(1+to 3+)and UPCR(r=0.746, p<0.01)was obtained. In patients with a urine protein content of 2+(qualitative analysis), the UPCR was <2.0 for 25 patients and ≥2.0 but <3.5 for 4 patients. Similarly, in patients with a urine protein content of 3+, the UPCR was <2.0 for 3 patients and ≥2.0 but <3.5 for 1 patient. Seventeen patients with a urine protein content of 2+ and 3 patients with a urine protein content of 3+ discontinued treatment with anti-angiogenic agents before estimation of the UPCR could be performed. These figures were reduced to 4 patients and 2 patients, respectively, following UPCR assessment.
Switching the estimation of proteinuria from a qualitative analysis to UPCR might lead to better safety monitoring and prevent unnecessary discontinuation of anti-angio- genic agent treatment.",1,1,0,The study includes patients with colorectal cancer.,The study examines the use of Ramucirumab as an anti-angiogenic agent.,"The study does not specifically describe the effect of Ramucirumab treatment, but rather evaluates the utility of UPCR in monitoring proteinuria across multiple anti-angiogenic agents including Ramucirumab."
38331650,Clinical colorectal cancer,2024,Jun,,Plasma Angiogenic Factors as Predictors of the Efficacy of Second-line Chemotherapy Combined with Angiogenesis Inhibitors in Metastatic Colorectal Cancer: Results From the GI-SCREEN CRC-Ukit Study.,"Journal Article, Multicenter Study, Observational Study","Satoshi Yuki, Kentaro Yamazaki, Yu Sunakawa, Hiroya Taniguchi, Hideaki Bando, Manabu Shiozawa, Tomohiro Nishina, Hisateru Yasui, Akiyoshi Kanazawa, Koji Ando, Yosuke Horita, Masahiro Goto, Naohiro Okano, Toshikazu Moriwaki, Taroh Satoh, Akihito Tsuji, Kaname Yamashita, Chiharu Asano, Yukiko Abe, Shogo Nomura, Takayuki Yoshino","The significance of angiogenic factors as predictors of second-line (2L) chemotherapy efficacy when combined with angiogenesis inhibitors for metastatic colorectal cancer (mCRC) remains unestablished.
In this multicenter prospective observational study, 17 angiogenic factors were analyzed in plasma samples collected at pretreatment and progression stages using a Luminex multiplex assay. Patients who received chemotherapy plus bevacizumab (BEV group), FOLFIRI plus ramucirumab (RAM group), or FOLFIRI plus aflibercept (AFL group) as the 2L treatment were included. Interactions between pretreatment and treatment groups for progression-free survival (PFS), overall survival (OS), and response rate (RR) were assessed using the propensity-score weighted Cox proportional hazards model.
From February 2018 to September 2020, 283 patients were analyzed in the 2L cohort. A strong interaction was observed for PFS between BEV and RAM with HGF, sNeuropilin-1, sVEGFR-1, and sVEGFR-3. Interactions for RR between the BEV and RAM groups were observed for sNeuropilin-1 and sVEGFR-1. Contrarily, OS, PlGF, sVEGFR-1, and sVEGFR-3 differentiated the treatment effect between BEV and AFL. Plasma samples were evaluable for dynamic analysis in 203 patients. At progression, VEGF-A levels significantly decreased in the BEV group and increased in the RAM and AFL groups.
The pretreatment plasma sVEGFR-1 and sVEGFR-3 levels could be predictive biomarkers for distinguishing BEV and RAM when combined with chemotherapy in 2L mCRC treatment. Based on the VEGF-A dynamics at progression, selecting RAM or AFL for patients with significantly elevated VEGF-A levels may be a 2L treatment strategy, with BEV considered for the third-line treatment.
UMIN000028616.",1,1,1,The study focuses on patients with metastatic colorectal cancer (mCRC).,The study examines the use of Ramucirumab as part of second-line treatment (FOLFIRI plus ramucirumab).,"The study describes the effect of Ramucirumab treatment by analyzing interactions with angiogenic factors and outcomes such as PFS, OS, and RR."
37667428,Thoracic cancer,2023,Oct,,Delayed esophageal anastomotic complication and ramucirumab therapy: A case report.,"Case Reports, Journal Article","Robert H Roth, Madison J Malfitano, Matthew Reilley, Linda W Martin","Current NCCN guidelines for second-line therapy in recurrent or metastatic esophago-gastric cancers recommend the use of VEGF inhibitors such as ramucirumab. VEGF inhibitors have been shown to be associated with gastrointestinal perforation in clinical trials and late colorectal anastomotic leaks in a few case reports. Here, we present a case of late esophageal anastomotic leak in a patient receiving ramucirumab. Case information was obtained from our institution's electronic medical records. The patient was found to have T4N1M0, poorly differentiated invasive adenocarcinoma and subsequently received neoadjuvant chemoradiation followed by hybrid Ivor-Lewis esophagectomy 6 weeks later. He recovered well with no leak or perioperative complications. The patient had disease progression 9 months postoperatively on CT and PET imaging. Sixteen months after surgery he began paclitaxel and ramucirumab and 16 weeks after ramucirumab initiation, he was found to have an esophago-pulmonary fistula in the region of the anastomosis. Biopsies were negative for recurrence at the anastomosis. He died one week later from progressive pneumonia despite stenting. In conclusion, this is the only known report of delayed esophageal anastomotic complication associated with ramucirumab. VEGF inhibitor therapies such as bevacizumab have been associated with late (greater than 3 months postoperative) colorectal anastomotic complications including fistulas and leaks. Risk factors that have been associated are perioperative radiotherapy and history of early postoperative leak. These findings raise concern whether VEGF inhibitor therapy should be used in post-esophagectomy patients with recurrence if these rare but catastrophic events are likely to be terminal.",-1,1,1,"The study focuses on a patient with esophageal cancer, not colorectal cancer.",The study examines the use of ramucirumab as part of treatment in a patient with esophageal cancer.,"The study describes the effect of ramucirumab treatment, specifically a delayed esophageal anastomotic complication."
38254839,Cancers,2024,Jan,13,Exploring the Spectrum of VEGF Inhibitors' Toxicities from Systemic to Intra-Vitreal Usage in Medical Practice.,"Journal Article, Review","Mariachiara Santorsola, Maurizio Capuozzo, Guglielmo Nasti, Francesco Sabbatino, Annabella Di Mauro, Giordana Di Mauro, Gianluca Vanni, Piera Maiolino, Marco Correra, Vincenza Granata, Oreste Gualillo, Massimiliano Berretta, Alessandro Ottaiano","The use of Vascular Endothelial Growth Factor inhibitors (VEGFi) has become prevalent in the field of medicine, given the high incidence of various pathological conditions necessitating VEGF inhibition within the general population. These conditions encompass a range of advanced neoplasms, such as colorectal cancer, non-small cell lung cancer, renal cancer, ovarian cancer, and others, along with ocular diseases. The utilization of VEGFi is not without potential risks and adverse effects, requiring healthcare providers to be well-prepared for identification and management. VEGFi can be broadly categorized into two groups: antibodies or chimeric proteins that specifically target VEGF (bevacizumab, ramucirumab, aflibercept, ranibizumab, and brolucizumab) and non-selective and selective small molecules (sunitinib, sorafenib, cabozantinib, lenvatinib, regorafenib, etc.) designed to impede intracellular signaling of the VEGF receptor (RTKi, receptor tyrosine kinase inhibitors). The presentation and mechanisms of adverse effects resulting from VEGFi depend primarily on this distinction and the route of drug administration (systemic or intra-vitreal). This review provides a thorough examination of the causes, recognition, management, and preventive strategies for VEGFi toxicities with the goal of offering support to oncologists in both clinical practice and the design of clinical trials.",1,1,0,The paper mentions colorectal cancer as one of the conditions where VEGF inhibitors are used.,The paper specifically lists ramucirumab as one of the VEGF inhibitors targeting VEGF.,The paper discusses the toxicities of VEGF inhibitors but does not specifically describe the effect of ramucirumab treatment in detail.
34259881,Der Pathologe,2021,Nov,,"BRAF testing in metastatic colorectal carcinoma and novel, chemotherapy-free therapeutic options.","Journal Article, Review","Michael Hummel, Susanna Hegewisch-Becker, Jens H L Neumann, Arndt Vogel","In the past 25 years, treatment of metastatic colorectal cancer (mCRC) has undergone profound changes. The approval of newer chemotherapeutics such as irinotecan and oxaliplatin was followed in 2005 by the first targeted therapies, for example, monoclonal antibodies directed against the epidermal growth factor receptor (EGFR), as cetuximab and panitumumab, or the angiogenesis inhibitors bevacizumab, ramucirumab, and aflibercept. With the rapidly progressing molecular characterization of mCRC in the last 10 years and the classification of the disease in four consensus subtypes, further changes are emerging, which will promote, among other things, the introduction of protein-kinase inhibitors developed for specific molecular aberrations as well as immune checkpoint inhibitors into the treatment algorithm.Thorough molecular pathologic testing is indispensable today for guideline-compliant treatment of mCRC patients. In addition to RAS testing as a precondition for the therapy decision with regard to cetuximab and panitumumab, BRAF testing is of considerable relevance to allow decision making with regard to the newly approved chemotherapy-free combination of the BRAF inhibitor encorafenib and cetuximab in cases where a BRAF-V600E mutation is detected. Additional diagnostic tests should also include genome instability (microsatellite instability). Overall, more and more molecular alterations need to be investigated simultaneously, so that the use of focused next-generation sequencing is increasingly recommended.This overview describes the prognostic relevance of BRAF testing in the context of molecular pathologic diagnostics of mCRC, presents new treatment options for BRAF-mutated mCRC patients, and explains which modern DNA analytical and immunohistochemical methods are available to detect BRAF mutations in mCRC patients.",1,-1,0,"The paper discusses metastatic colorectal cancer (mCRC), which aligns with the specified patient population.","The paper mentions ramucirumab as one of several angiogenesis inhibitors but does not focus on its use, effect, or sensitivity as a main treatment.",The paper does not specifically describe the effect of ramucirumab treatment; it provides a general overview of treatment options and molecular testing.
31608707,Expert opinion on biological therapy,2020,Jan,,The role of PIGF blockade in the treatment of colorectal cancer: overcoming the pitfalls.,"Journal Article, Research Support, Non-U.S. Gov't, Review","Teresa Macarulla, Clara Montagut, Francisco Javier Sánchez-Martin, Mónica Granja, Helena Verdaguer, Javier Sastre, Josep Tabernero","Introduction: In colorectal cancer, anti-VEGF agents have demonstrated a survival benefit when combined with chemotherapy. However, development of resistance is very common. One of the mechanisms is due not to a failure in the VEGFR blockade, but rather to development of compensatory mechanisms of resistance, such as hypoxia-triggered upregulation of other proangiogenic factors, like placental growth factor (PlGF).Areas covered: This article summarizes the fundamental role of PlGF in the development of resistance to antiangiogenic treatment as well as the efficacy of aflibercept, ramucirumab, and regorafenib.Expert opinion: Aflibercept functions as a soluble decoy receptor precluding VEGFs and PlGF from binding to native VEGFR, and therefore preventing the emergence of resistance. Bevacizumab limits its function to preventing the interaction between VEGF-A and VEGFR. In combination with FOLFIRI (VELOUR trial), aflibercept improves survival in patients with metastatic CRC who are resistant or have progressed to oxaliplatin-based chemotherapy. Ramucirumab, a fully humanized immunoglobulin G1 (IgG-1) monoclonal antibody and regorafenib, a multikinase inhibitor, have significant improvement for overall survival as well as for progression-free survival in chemotherapy refractory settings.",1,1,1,"The paper discusses colorectal cancer and its treatment with anti-VEGF agents, including ramucirumab.",The paper explicitly mentions ramucirumab as one of the agents examined for its role in treating colorectal cancer.,"The paper describes the effect of ramucirumab treatment, noting its significant improvement in overall and progression-free survival in chemotherapy refractory settings."
30917706,Expert opinion on biological therapy,2019,May,,Ramucirumab: the long and winding road toward being an option for mCRC treatment.,"Journal Article, Research Support, Non-U.S. Gov't, Review","Celine Debeuckelaere, Sabina Murgioni, Sara Lonardi, Noemi Girardi, Giulia Alberti, Carolina Fano, Sara Gallimberti, Cristina Magro, Selma Ahcene-Djaballah, Francesca Daniel, Matteo Fassan, Hans Prenen, Fotios Loupakis","Colorectal cancer (CRC) is one of the main causes of cancer-related morbidity and mortality worldwide. Mortality is most often attributable to metastatic disease. Despite the progress achieved so far, life expectancy continues to be limited in most patients. Ramucirumab, a most recent antiangiogenic drug, is vying in the race to metastatic CRC (mCRC) treatment since its approval by the Food and Drug Administration (FDA), based on the results of the RAISE study.
This article reviews the role of ramucirumab in mCRC, including clinical indication, safety issues, and future perspectives.
The use of Ramucirumab in clinical practice is still limited, probably due to economic burden and the lack of specific biomarkers. Future efforts will be addressed to improve our knowledge in the use of this drug and better guide us in patients' care.",1,1,0,The paper explicitly discusses patients with colorectal cancer (CRC).,The paper examines the use of Ramucirumab in the treatment of metastatic CRC.,"The paper provides a review of Ramucirumab's role, but does not present specific data or results on its treatment effects from a study."
34816395,Molecular diagnosis & therapy,2021,Nov,,Economic Evaluation of Monoclonal Antibodies in Metastatic Colorectal Cancer: A Systematic Review.,"Journal Article, Systematic Review","Stavroula Koilakou, Panagiotis Petrou","Colorectal cancer (CRC) is one of the major causes of mortality and morbidity worldwide. The median overall survival (OS) of patients with metastatic CRC (mCRC) has doubled over the last 20 years partly due to the introduction of advanced biologic therapies. However, these treatment modalities bear significant costs on healthcare systems globally, and may jeopardize their fiscal sustainability. The aim of this systematic review was to critically appraise the economic evaluations of monoclonal antibodies in mCRC.
A literature search was performed in the electronic databases of: Cochrane Central Register of Controlled Trials, Cochrane Database of Systematic Reviews, Database of Abstracts of Reviews of Effects, EMBASE, EMBASE Alert, PUBMED, NHS Economic Evaluation and Health Technology Assessment Database for full articles published from 1 January 2013 to 31 December 2020.
Twenty economic analyses were identified in the literature that fulfilled the inclusion criteria and evaluated the cost-effectiveness of (a) bevacizumab as first-line treatment for mCRC and as maintenance treatment, (b) cetuximab as first-line treatment, (c) panitumumab versus bevacizumab and cetuximab versus bevacizumab as first-line treatment, (d) aflibercept and ramucirumab as second-line treatment, (e) cetuximab and panitumumab as third-line treatment, (f) cetuximab versus panitumumab as later lines of treatment, and (g) RAS testing prior to anti-epidermal growth factor receptor (EGFR) treatment.
Bevacizumab in combination with chemotherapy is cost-effective as neither first-line treatment nor maintenance treatment. Sequential treatment with bevacizumab in first-line and second-line treatment was also not cost-effective. Testing for KRAS and extended RAS mutations is cost-effective and should be performed prior to anti-EGFR treatment. In the RAS wild-type subgroup of mCRCs the use of anti-EGFR (panitumumab or cetuximab) in first-line treatment leads to a more favorable cost-effectiveness profile than the corresponding anti-VEGF (bevacizumab). Cetuximab is not cost-effective as a first-line treatment. Anti-EGFR administration is not a cost-effective strategy in third-line treatment, even for RAS wild-type mCRCs, compared to best supportive care. Aflibercept was superior to ramucirumab and costed less, but neither were cost-effective compared to standard care.",1,1,1,The study focuses on patients with colorectal cancer (mCRC).,The study examines the use of Ramucirumab as a second-line treatment in metastatic colorectal cancer.,"The study describes the effect of Ramucirumab treatment, noting that it was not cost-effective compared to standard care."
37818063,American journal of cancer research,2023,,,Clinical and cost-effectiveness analysis of mFOLOFX6 with or without a targeted drug among patients with metastatic colorectal cancer: inverse probability of treatment weighting.,Journal Article,"Hsiang-Lin Tsai, Hon-Yi Shi, Yen-Cheng Chen, Ching-Wen Huang, Wei-Chih Su, Tsung-Kun Chang, Ching-Chun Li, Po-Jung Chen, Yung-Sung Yeh, Tzu-Chieh Yin, Jaw-Yuan Wang","This study investigated the cost-effectiveness and quality of life (QoL) within 1 year of receiving mFOLOFX6 with or without a targeted drug (bevacizumab or ramucirumab) as second-line treatment among patients with metastatic colorectal cancer (mCRC) following the failure of FOLFIRI + bevacizumab as first-line treatment. This prospective cohort study included patients who received a diagnosis of mCRC between March 2015 and May 2020. QoL was evaluated before treatment and at 6 months and 1 year posttreatment. All related variables were controlled using the inverse probability of treatment weighting method. Generalized estimating equations with the difference-in-difference method was used to explore changes in QoL. The incremental cost-utility ratio (ICUR) of the two groups was simulated using the annual-cycle Markov decision tree model. Finally, 39 and 76 patients were included in the targeted and nontargeted agent groups, respectively. At 6 months after treatment, QoL of the two groups improved significantly, but the targeted agent group had significantly better QoL than did the nontargeted agent group at 1 year posttreatment (P < 0.05). When the time frame was set to 20 years, the ICUR of the targeted agent group compared with the nontargeted agent group was US$32,052 per quality-adjusted life years. Addition of a targeted drug to the second-line mFOLOFX6 regimen not only improved the patients' QoL but was also more cost effective when the willingness-to-pay threshold was set at US$33,004 (the per capita gross domestic product of Taiwan). These patients should be reimbursed for these targeted agents by the National Health Insurance scheme in Taiwan.",1,1,1,The study focuses on patients with metastatic colorectal cancer (mCRC).,The study examines the use of ramucirumab as a targeted drug in combination with mFOLOFX6 as second-line treatment.,"The study describes the effect of ramucirumab treatment, showing improved quality of life and cost-effectiveness compared to the nontargeted agent group."
33889280,World journal of gastrointestinal oncology,2021,Apr,15,Clinical efficacy and safety of second line and salvage aflibercept for advanced colorectal cancer in Akita prefecture.,Journal Article,"Taichi Yoshida, Kentaro Takahashi, Kengo Shibuya, Osamu Muto, Yuko Yoshida, Daiki Taguchi, Kazuhiro Shimazu, Koji Fukuda, Fuminori Ono, Kyoko Nomura, Hiroyuki Shibata","Angiogenesis inhibitors (AIs) combination with cytotoxic chemotherapy is a promising treatment for patients with colorectal cancer (CRC). Aflibercept (AFL) is an option for second-line treatment of CRC, according to the 'VELOUR' trial. Currently, we can choose from three AIs, including bevacizumab, ramucirumab, and AFL. Different AIs can be used in subsequent treatment because of their distinctive mechanisms of action. We addressed the uncertainty regarding AFL efficacy and safety in heavily-treated patients by comparing outcomes of survival treatment with second-line treatment.
To determine and compare the efficacy and safety profiles of AFL in the second-line and salvage therapy settings.
Clinical data of 41 patients with advanced CRC who received intravenous AFL combined with the folinic acid-fluorouracil-irinotecan (FOLFIRI) regimen were collected retrospectively from six institutions in Japan, for the period from May 2017 to March 2019. Patient characteristics collected included age, sex, tumor location, RAS and RAF status, metastatic sites, number of previous treatment cycles, therapeutic response, adverse events, duration of previous AI treatment, and survival time. The end points were time to AFL treatment failure (aTTF) and median survival time post-AFL (aMST). Statistical analyses were performed to compare the efficacy and safety in the second-line setting with those of the salvage therapy setting, which was defined as the days since the end of second-line therapy.
All 41 patients who received AFL + FOLFIRI for advanced CRC had metastatic or unresectable cancer. Twenty-two patients received AFL in the second-line setting and nineteen in the salvage therapy setting. The patient characteristics were similar in the two groups, except for two factors. The median duration of the previous AI administration was shorter in the second-line patients compared with that in the salvage therapy patients (144 d vs 323 d, P = 0.006). In the second-line and salvage therapy groups, the objective response rates were 11% and 0%, respectively (P = 0.50), and the disease control rates were 53% and 50%, respectively (P = 1.00). In the second-line and salvage therapy groups, the aTTF (123 d vs 71 d, respectively), aMST (673 d vs 396 d, respectively), and incidence of adverse events of grade 3 [8 (36%) vs 9 (47%)] were not significantly different between the two groups.
AFL can be used to treat advanced CRC patients, with a similar safety and efficacy in the salvage therapy setting as in the second-line setting.",1,-1,0,The study focuses on patients with advanced colorectal cancer.,"The study examines aflibercept, not ramucirumab, as the angiogenesis inhibitor.",The study does not describe the effect of ramucirumab treatment.
