PMID,Journal,Year,Month,Day,Title,Publication Type,Authors,Abstract,s1,s2,s3,r1,r2,r3
1835597,"European journal of cancer (Oxford, England : 1990)",1991,,,"In vitro influence of gastrin, oestradiol and gonadotropin-releasing hormone on HCT-15 and LoVo human colorectal neoplastic cell proliferation.","Journal Article, Research Support, Non-U.S. Gov't","R Kiss, I Salmon, O Pauwels, S Gras, A Danguy, C Etievant, J L Pasteels, J Martinez","We set up in vitro several human colorectal neoplastic cell lines that we labelled ""hormone-sensitive"" (HS) in comparison to the original cell lines which appeared to be rather ""hormone-insensitive"" (HI). We used LoVo and HCT-15 human colorectal neoplastic cell lines and studied the influence of 17 beta-oestradiol (E2), gastrin and two gonadotropin-releasing hormone (GnRH) analogues, HRF and buserelin, on the proliferation of the HS and HI variants of the LoVo and HCT-15 cell lines. Cell proliferation was evaluated by a colorimetric assay, the MTT test. Our results show that E2, gastrin, HRF and buserelin did not induce a significant stimulatory influence on the HI variants of the LoVo and HCT-15 cells, i.e. the cells that were cultured in a hormone-free 10% FCS-supplemented medium. In sharp contrast, the colorectal cells cultured for 30 passages in an E2 and/or gastrin + 1% FCS-supplemented medium showed a marked tropic response to E2, gastrin, HRF and buserelin. However, the HS variants of the HCT-15 cells appeared less sensitive to the two GnRH analogues than did the HS variants of the LoVo cells.",1,1,1,"The study involves human colorectal neoplastic cell lines (LoVo and HCT-15), which are relevant to colorectal cancer.","The study examines the effect of Buserelin, a GnRH analogue, on the proliferation of colorectal cancer cell lines.",The study describes the effect of Buserelin treatment on hormone-sensitive variants of colorectal cancer cell lines.
8372885,American journal of obstetrics and gynecology,1993,Sep,,Laparoscopic evaluation of the onset and progression of endometriosis.,Journal Article,"H Hoshiai, M Ishikawa, Y Sawatari, K Noda, T Fukaya","To clarify the pathogenesis of endometriosis on the basis of analysis of primary lesion sites, age at onset, rate of progression, and response to drug treatment.
The clinical records of 690 women with laparoscopically confirmed endometriosis were retrospectively analyzed based on the revised American Fertility Society point system.
The primary site of endometriosis was the uterosacral ligament and pelvic peritoneum/pouch of Douglas in 73% of patients with stage I disease, whereas only 16% had ovarian lesions. However, disease progression was associated with an increasing frequency of ovarian lesions. In terms of the revised American Fertility Society score, endometriosis progressed at a mean rate of 0.3 point per month. Thus the earliest onset of endometriosis was estimated at 3 to 4 years after menarche. Drug therapy improved the revised American Fertility Society score by about 50%. Patients with a low response to an initial cycle of therapy generally showed further improvement after an additional treatment cycle.
Because endometriosis may occur as early as 3 to 4 years after menarche and gradually progresses, drug therapy, including long-term treatment, should be carried out in women with definitive evidence of endometriosis who must maintain their reproductive potential.",-1,-1,-1,"The study focuses on patients with endometriosis, not colorectal cancer.",The study does not mention Buserelin as a treatment or examine its use or effect.,The study does not describe the effect of Buserelin treatment.
1356011,The Journal of steroid biochemistry and molecular biology,1992,Sep,,Novel antitumor peptide hormones and their effect on signal transduction.,"Journal Article, Research Support, Non-U.S. Gov't","G Kéri, A Balogh, A Horváth, I Mezö, Z Vadász, G Bökönyi, T Bajor, T Vántus, I Teplán, J Horváth","A series of novel gonadotropin releasing hormone (GnRH) and Somatostatin analogs have been developed in our laboratory and were screened for antiproliferative and signal transduction inhibitory effect. Our GnRH analog Folligen, had significant antitumor activity on DMBA induced mammary carcinomas in rats without blocking ovarian functions. The direct effect of Folligen and Buserelin has been compared on the human breast cancer cell line MDA-MB-231. Folligen was found to be more effective in inhibiting cell proliferation and significant differences were found in the signal transduction pathways activated by these analogs. Our novel Somatostatin analogs were screened for tyrosine kinase inhibition and for antiproliferative effect on human colon tumor cells and for growth hormone (GH) release inhibition in vitro and in vivo. The analog TT-2-50 was significantly more active inhibiting GH release in superfused rat pituitary cells and in vivo than native Somatostatin and it strongly inhibited tyrosine kinase and proliferation while it stimulated protein kinase C activity.",-1,1,1,"The study focuses on mammary carcinomas in rats and human breast cancer cell lines, not colorectal cancer.",The study examines the use and effect of Buserelin on human breast cancer cell lines.,The study describes the effect of Buserelin treatment on cell proliferation and signal transduction pathways.
