PMID,Journal,Year,Month,Day,Title,Publication Type,Authors,Abstract,s1,s2,s3,r1,r2,r3
32603594,Journal of medicinal chemistry,2020,Jul,23,Discovery of Novel PDEδ Degraders for the Treatment of KRAS Mutant Colorectal Cancer.,"Journal Article, Research Support, Non-U.S. Gov't","Junfei Cheng, Yu Li, Xu Wang, Guoqiang Dong, Chunquan Sheng","KRAS-PDEδ protein-protein interaction represents an appealing target for cancer therapy. However, fast release of high-affinity inhibitors from PDEδ hampered drug binding affinity and antiproliferative activity. To overcome the limitations, the first proteolysis-targeting chimeric (PROTAC) small molecules targeting PDEδ were designed. By employment of PDEδ inhibitor deltazinone (2) and cereblon ligand pomalidomide (6), a series of potent PROTAC PDEδ degraders were obtained. The most promising compound 17f efficiently induced PDEδ degradation and demonstrated significantly improved antiproliferative potency in KRAS mutant SW480 cells. Compound 17f also achieved significant tumor growth inhibition in the SW480 colorectal cancer xenograft model. This proof-of-concept study provided a new strategy to validate the druggability of KRAS-PDEδ interaction and offered an effective lead compound for the treatment of KRAS mutant cancer.",1,1,1,The study involves SW480 colorectal cancer cells and a xenograft model of colorectal cancer.,Pomalidomide is used as a cereblon ligand to create PROTAC molecules targeting PDEδ.,The study describes the effect of pomalidomide in combination with deltazinone to create PROTACs that induce PDEδ degradation and show antiproliferative effects.
19638977,British journal of cancer,2009,Sep,01,Inhibition of metastatic potential in colorectal carcinoma in vivo and in vitro using immunomodulatory drugs (IMiDs).,Journal Article,"W M Liu, J Y Henry, B Meyer, J B Bartlett, A G Dalgleish, C Galustian","Thalidomide and lenalidomide are FDA approved for the treatment of multiple myeloma and, along with pomalidomide, are being investigated in various other cancers. Although these agents display immunomodulatory, anti-angiogenic and anti-apoptotic effects, little is known about their primary mode of therapeutic action in patients with cancer.
As part of a continuing research effort, we have investigated the effects of these agents on the metastatic capacity of murine colorectal cancer cell lines both in vivo and in vitro. Allied to these, we have studied their effects on the molecular pathways associated with metastasis.
Results indicate that thalidomide, lenalidomide and pomalidomide significantly inhibit the metastatic capability of colorectal carcinoma cells. Anchorage-independent growth, used as a coarse indicator of transformation, was significantly reduced, as were migratory capacity and invasive competence. In addition, an in vivo experimental metastasis model also showed that treatment with the drugs resulted in a significantly lower number of metastatic pulmonary nodules relative to control mice. Allied to these cellular and phenotypic changes were alterations in molecular markers of metastasis and in intracellular signalling competency.
These results provide evidence that in addition to their immunomodulatory effects, thalidomide, lenalidomide and pomalidomide can impair the metastatic capacity of tumours, and that this mechanism may involve alterations to cell signalling functionality.",1,1,1,"The study investigates the effects of pomalidomide on murine colorectal cancer cell lines, both in vivo and in vitro, confirming the focus on colorectal cancer.",The study explicitly mentions pomalidomide as one of the immunomodulatory drugs (IMiDs) being investigated for its effects on colorectal cancer.,"The study describes the effect of pomalidomide treatment, including its inhibition of metastatic potential, reduction in migratory capacity, and impact on molecular markers associated with metastasis."
19597962,Molecular biology reports,2010,Apr,,A microarray study of altered gene expression in colorectal cancer cells after treatment with immunomodulatory drugs: differences in action in vivo and in vitro.,"Journal Article, Research Support, Non-U.S. Gov't","Wai M Liu, Holger Laux, Jake Y Henry, Thomas B Bolton, Angus G Dalgleish, Christine Galustian","Thalidomide and lenalidomide are FDA approved for the treatment of multiple myeloma, and along with pomalidomide are being investigated in a variety of other cancers. Although these agents display immunomodulatory, anti-angiogenic and anti-apoptotic effects, little is known about the primary mode of therapeutic action in patients with cancer. This paper describes a microarray study of the in vitro and in vivo effects of these drugs, and contrasts the difference in gene profiles achieved in the two models. In the current study, Agilent whole mouse genome oligonucleotide microarrays (44 K) were used to examine alterations in gene expression of colorectal cancer cells after treatment. Venn analysis revealed a divergence of gene signature for pomalidomide and lenalidomide, which although similar in vitro, different in vivo. Several clusters of genes involved in various cellular processes such as immune response, cell signalling and cell adhesion were altered by treatment, and common to the three drugs. Notably, the expressions of linked genes within the Notch/Wnt signalling pathway, including kremen2 and dtx4, highlighted a possible novel mechanistic pathway for these drugs. This study also showed that gene signatures were not greatly divergent in the models, and recapitulated the complex nature of these drugs. Overall, these microarray studies highlighted the diversity of this class of drug, which have effects ranging from cell signalling to translation initiation.",1,1,1,The study explicitly mentions colorectal cancer cells as the subject of the research.,The study examines the effects of pomalidomide on colorectal cancer cells in both in vitro and in vivo models.,The study describes the effects of pomalidomide treatment on gene expression profiles in colorectal cancer cells.
38730656,Cancers,2024,Apr,27,Dissecting the Puzzling Roles of FAM46C: A Multifaceted Pan-Cancer Tumour Suppressor with Increasing Clinical Relevance.,"Journal Article, Review","Giancarlo Lai, Federica De Grossi, Ilaria Catusi, Elisa Pesce, Nicola Manfrini","FAM46C is a well-established tumour suppressor with a role that is not completely defined or universally accepted. Although FAM46C expression is down-modulated in several tumours, significant mutations in the FAM46C gene are only found in multiple myeloma (MM). Consequently, its tumour suppressor activity has primarily been studied in the MM context. However, emerging evidence suggests that FAM46C is involved also in other cancer types, namely colorectal, prostate and gastric cancer and squamous cell and hepatocellular carcinoma, where FAM46C expression was found to be significantly reduced in tumoural versus non-tumoural tissues and where FAM46C was shown to possess anti-proliferative properties. Accordingly, FAM46C was recently proposed to function as a pan-cancer prognostic marker, bringing FAM46C under the spotlight and attracting growing interest from the scientific community in the pathways modulated by FAM46C and in its mechanistic activity. Here, we will provide the first comprehensive review regarding FAM46C by covering (1) the intracellular pathways regulated by FAM46C, namely the MAPK/ERK, PI3K/AKT, β-catenin and TGF-β/SMAD pathways; (2) the models regarding its mode of action, specifically the poly(A) polymerase, intracellular trafficking modulator and inhibitor of centriole duplication models, focusing on connections and interdependencies; (3) the regulation of FAM46C expression in different environments by interferons, IL-4, TLR engagement or transcriptional modulators; and, lastly, (4) how FAM46C expression levels associate with increased/decreased tumour cell sensitivity to anticancer agents, such as bortezomib, dexamethasone, lenalidomide, pomalidomide, doxorubicin, melphalan, SK1-I, docetaxel and norcantharidin.",1,1,1,The paper mentions colorectal cancer as one of the cancer types where FAM46C expression is significantly reduced.,The paper explicitly lists pomalidomide as one of the anticancer agents whose sensitivity is associated with FAM46C expression levels.,"The paper discusses how FAM46C expression levels associate with tumour cell sensitivity to pomalidomide, indicating an effect of the treatment."
36638778,Expert review of anticancer therapy,2023,Mar,,Safety and efficacy of Elotuzumab combination therapy for patients with multiple myeloma: A systematic review and meta-analysis.,"Meta-Analysis, Systematic Review, Journal Article","Maryam Noori, Farimah Fayyaz, Nima Rezaei","We evaluate the efficacy and safety of Elotuzumab, an immunostimulatory monoclonal antibody, in combination with concomitant treatment regimens for multiple myeloma (MM) patients.
PubMed, Scopus, Web of Science, and EMBASE databases were searched systematically up to 2 August 2022.
Five randomized control trials with a total of 1,763 participants were included. Elotuzumab combination therapy improved PFS and OS by 14% (hazard ratio [HR] 0.86) and 20% (HR 0.80), respectively, relative to the non-Elotuzumab regimen. Adding Elotuzumab to Lenalidomide plus Dexamethasone regimen (HR 0.82) or Pomalidomide plus Dexamethasone regimen (HR 0.54) were considered to improve the PFS. Meanwhile, the risk of disease progression was only reduced for patients with relapsed/refractory MM (HR 0.70) but not for newly diagnosed/untreated MM (HR 0.93). Finally, the risk of serious adverse events (RR 1.12) and the risk of infection (RR 1.09) and cardiac disorders (RR 1.32) were higher for the experimental group compared to the control group.
Our findings showed that Elotuzumab combination therapy prolonged OS and PFS compared to non-Elotuzumab treatments in patients with MM. However, further investigations are required to establish the most effective combination of the Elotuzumab regimen.",-1,1,1,"The study focuses on patients with multiple myeloma, not colorectal cancer.",The study examines the use of Pomalidomide in combination with Elotuzumab as part of the treatment regimen.,"The study describes the effect of Pomalidomide treatment in combination with Elotuzumab, showing improved PFS with a hazard ratio of 0.54."
28452243,Expert opinion on therapeutic patents,2017,Jun,,Evaluation of US 2016/0115161 A1: isoindoline compounds and methods of their use.,Journal Article,"Rok Frlan, Stanislav Gobec","Immunomodulatory drugs (IMIDs®) are small orally available molecules that modulate the immune system and other biological targets through multiple mechanisms of action and have been successfully used in the treatment of myelodysplastic syndrome and multiple myeloma. However, recent studies of their complex mechanism of action revealed their potential in autoimmune diseases and solid tumors, which intensified scientific interest in these compounds. Areas covered: This patent application claims new IMIDs for the treatment of cancer and disorders associated with angiogenesis and inflammation. Substitution of isoindolinone ring on position 5 with urea and amide linkers connected to different aromatic rings lead to very potent inhibitors of TNF-α production with antiproliferative activities against Nemalwa cells and against colorectal, pancreatic, prostate and breast cancer cell lines in sub-nano to low-nanomolar concentration range. Expert opinion: Substitution of position 5 on the isoindolinone ring, which is presented in this invention, is currently the hot spot of Celgene's research. Results of biological tests, which are superior over those of presently used IMIDs lenalidomide and pomalidomide, make these compounds viable leads for future development of new anticancer drugs against blood and solid cancers.",1,-1,0,The paper mentions colorectal cancer cell lines as targets of the new isoindoline compounds.,"The study does not specifically examine pomalidomide as a treatment; it discusses new compounds derived from IMIDs, not pomalidomide itself.","The paper describes the effects of the new compounds, not specifically pomalidomide treatment."
41290730,Scientific reports,2025,Nov,25,Discovery of a Proteolysis Targeting Chimera for TRKA and RET-derived oncoproteins.,Journal Article,"Marialuisa Moccia, Lingzhi Zhang, Zhengyu Wang, Minmin Wang, Giorgia Federico, Massimo Santoro, Hong-Yu Li, Francesca Carlomagno","We designed Proteolysis Targeting Chimeras (PROTACs) to target Tropomyosin Receptor Kinase A (TRKA) and Rearranged during Transfection (RET) oncogenic proteins. We analyzed a series of 22 PROTACs, based on the RET and TRKA small molecule inhibitor Pz-1 and ligands of E3 ligase complex component Cereblon (CRBN). The compounds were tested in TPC-1 and KM12 cells, derived from papillary thyroid carcinoma and colorectal carcinoma, and harboring the CCDC6-RET and TPM3-TRKA oncoproteins, respectively. We identified several RET and TPM3-TRKA PROTACs, able to induce their degradation. Consistently, one of the most active degraders, compound 9, exhibited a strong anti-proliferative effect in several cancer cell lines derived from human medullary and papillary thyroid, lung and colon cancers, displaying either RET or TRKA-derived oncoproteins, with an IC50 dose of one digit nM. Mechanistically, TPM3-TRKA degradation by compound 9 was dependent on CRBN-mediated polyubiquitination and proteasomal degradation; accordingly, it was hindered by inhibitors of the proteasome (MG132) or Cullins (MLN4924), by dominant negative Cullin 4A mutant, and by free pomalidomide. Saturating amounts of compound 9 featured loss of activity, consistently with the bivalent binding of a PROTAC (""hook effect""). Finally, a compound 9 derivative, compound 20, induced in vivo degradation of TMP3-TRKA in KM12 cells mouse xenografts. In conclusion, our study indicated that PROTAC-mediated degradation is an efficient strategy to intercept RET and TRKA oncogenic signaling.",1,-1,0,"The paper mentions KM12 cells derived from colorectal carcinoma, which is relevant to colorectal cancer.",The study does not focus on pomalidomide as a treatment; it mentions free pomalidomide in a mechanistic context but does not examine its use or effect as a main treatment.,"The paper describes the effect of free pomalidomide in a mechanistic context (inhibition of CRBN-mediated degradation), but does not specifically describe pomalidomide treatment as a therapeutic intervention."
19009291,"Cancer immunology, immunotherapy : CII",2009,Jul,,The anti-cancer agents lenalidomide and pomalidomide inhibit the proliferation and function of T regulatory cells.,Journal Article,"Christine Galustian, Brendan Meyer, Marie-Christine Labarthe, Keith Dredge, Deborah Klaschka, Jake Henry, Stephen Todryk, Roger Chen, George Muller, David Stirling, Peter Schafer, J Blake Bartlett, Angus G Dalgleish","Lenalidomide (Revlimid; CC-5013) and pomalidomide (CC-4047) are IMiDs proprietary drugs having immunomodulatory properties that have both shown activity in cancer clinical trials; lenalidomide is approved in the United States for a subset of MDS patients and for treatment of patients with multiple myeloma when used in combination with dexamethasone. These drugs exhibit a range of interesting clinical properties, including anti-angiogenic, anti-proliferative, and pro-erythropoietic activities although exact cellular target(s) remain unclear. Also, anti-inflammatory effects on LPS-stimulated monocytes (TNF-alpha is decreased) and costimulatory effects on anti-CD3 stimulated T cells, (enhanced T cell proliferation and proinflammatory cytokine production) are observed. These drugs also cause augmentation of NK-cell cytotoxic activity against tumour-cell targets. Having shown that pomalidomide confers T cell-dependent adjuvant-like protection in a preclinical whole tumour-cell vaccine-model, we now show that lenalidomide and pomalidomide strongly inhibit T-regulatory cell proliferation and suppressor-function. Both drugs inhibit IL-2-mediated generation of FOXP3 positive CTLA-4 positive CD25high CD4+ T regulatory cells from PBMCs by upto 50%. Furthermore, suppressor function of pre-treated T regulatory cells against autologous responder-cells is abolished or markedly inhibited without drug related cytotoxicity. Also, Balb/C mice exhibit 25% reduction of lymph-node T regulatory cells after pomalidomide treatment. Inhibition of T regulatory cell function was not due to changes in TGF-beta or IL-10 production but was associated with decreased T regulatory cell FOXP3 expression. In conclusion, our data provide one explanation for adjuvant properties of lenalidomide and pomalidomide and suggest that they may help overcome an important barrier to tumour-specific immunity in cancer patients.",-1,1,1,The study does not mention colorectal cancer specifically; it discusses general cancer and preclinical models without specifying colorectal cancer.,"The study examines the effects of pomalidomide, highlighting its use in cancer models and its immunomodulatory properties.","The study describes the effect of pomalidomide treatment, specifically its inhibition of T regulatory cell proliferation and function."
