PMID,Journal,Year,Month,Day,Title,Publication Type,Authors,Abstract,s1,s2,s3,r1,r2,r3
36592505,"European journal of cancer (Oxford, England : 1990)",2023,Feb,,Does the number of 6-monthly adjuvant zoledronate infusions received affect treatment efficacy for early breast cancer? A sub-study of ABCSG-12.,"Journal Article, Randomized Controlled Trial","Ana-Alicia Beltran-Bless, Mark J Clemons, Christian Fesl, Richard Greil, Gregory R Pond, Marija Balic, Lisa Vandermeer, Vesna Bjelic-Radisic, Christian F Singer, Guenther G Steger, Ruth Helfgott, Daniel Egle, Lidija Sölkner, Simon P Gampenrieder, Stephanie Kacerovsky-Strobl, Christoph Suppan, Magdalena Ritter, Gabriel Rinnerthaler, Georg Pfeiler, Hannes Fohler, Dominik Hlauschek, John Hilton, Michael Gnant","The widespread adoption of adjuvant bisphosphonate therapy for postmenopausal early breast cancer (EBC) patients was based on results of the Early Breast Cancer Trialist Group (EBCTCG) meta-analysis. Despite multiple regimens evaluated, there was no signal of varying efficacy with type, dose/dose intensity of bisphosphonate administration. We evaluated the effect of early treatment cessation using long-term outcome data from the ABCSG-12 trial.
ABCSG-12 randomized 1803 hormone-receptor positive EBC patients on ovarian suppression between 1999 and 2006 to receive 4 mg zoledronic acid 6-monthly or not (and tamoxifen or anastrozole, 2:2 factorial design). In the current study, we evaluated whether the number of zoledronate infusions had an impact on breast cancer-specific outcomes. We hypothesized that amongst patients who received at least one zoledronate infusion, the number of infusions had no effect on outcomes. Time-to-event endpoints were analysed with Cox models and Kaplan Meier curves starting from a 3-year landmark. BMD analysis was restricted to patients who participated in the BMD sub-study.
725 patients who received at least one zoledronate infusion were included in the time-to-event analysis. There was no statistically significant difference in disease-free or overall survival in the patients who received ≤6 zoledronate infusions (n = 170) compared to those who received ≥7 zoledronate infusions (n = 555).
Comparable to efforts to de-escalate treatment duration in metastatic bone disease, there was no evidence to indicate that a reduced number of zoledronate infusions is associated with reduced adjuvant efficacy. Further studies to define optimal regimens of adjuvant bone-targeted therapies are required.",-1,1,1,"The study focuses on patients with early breast cancer, not colorectal cancer.",The study examines the use of anastrozole as part of a factorial design with zoledronate.,The study describes the effect of anastrozole treatment in the context of adjuvant therapy for early breast cancer.
19944537,Cancer treatment reviews,2010,Feb,,Switching from tamoxifen to aromatase inhibitors for adjuvant endocrine therapy in postmenopausal patients with early breast cancer.,"Journal Article, Research Support, Non-U.S. Gov't, Review","C J H van de Velde, S Verma, J G H van Nes, C Masterman, K I Pritchard","The third-generation aromatase inhibitors (AIs), including anastrozole, exemestane and letrozole, have demonstrated improved efficacy versus tamoxifen for the adjuvant endocrine treatment of postmenopausal patients with hormone receptor-positive breast cancer. AIs can be used in several adjuvant endocrine settings: as upfront therapy, switch to an AI after 2-3years of tamoxifen or extended therapy following 5years of tamoxifen. In the switch setting, two different types of study designs have been utilized. One is a late randomization design which randomizes patients who are disease-free after 2-3years of tamoxifen to receive an AI versus continuation of tamoxifen. In contrast, an early randomization design randomizes all patients immediately after primary treatment and prior to starting tamoxifen. Efficacy benefits with AIs have been shown in several trials evaluating the late randomization strategy, including the Intergroup Exemestane Study, the Italian Tamoxifen Anastrozole trial and the Anastrozole-Nolvadex 95 trial. Similarly, early randomization studies, including the Austrian Breast and Colorectal Cancer Study Group-8 and the Breast International Group (BIG) 1-98 trial, have demonstrated the effectiveness of receiving an AI after tamoxifen. Two trials are assessing an early switch strategy versus upfront AI therapy: the BIG 1-98 trial and the ongoing Tamoxifen Exemestane Adjuvant Multicentre trial are assessing switching from tamoxifen to an AI after 2-3years versus upfront AI therapy. This paper reviews studies that have investigated a switch strategy with AIs and considers the implications of these data on treatment choice for postmenopausal patients with hormone receptor-positive breast cancer.",-1,1,1,"The study focuses on patients with breast cancer, not colorectal cancer.",The study examines the use of anastrozole as part of adjuvant endocrine therapy in postmenopausal patients with hormone receptor-positive breast cancer.,The study describes the effect of anastrozole treatment in comparison to tamoxifen in the context of adjuvant endocrine therapy.
17938958,Journal of cancer research and clinical oncology,2008,Jan,,Increasing protection after tamoxifen: insights from the extended adjuvant aromatase inhibitor trials.,"Journal Article, Review",Carsten Rose,"For disease-free postmenopausal women with hormone-responsive breast cancer, a risk for relapse remains following 5 years of adjuvant therapy with tamoxifen. Additional therapy with tamoxifen beyond 5 years is not indicated due to a demonstrated lack of efficacy beyond this time frame. Thus, there is a need for other endocrine therapy options in the period beyond 5 years. The third-generation aromatase inhibitors (anastrozole, letrozole, and exemestane) have emerged as at least as effective and somewhat better tolerated alternatives to tamoxifen. Three trials were initiated to evaluate the efficacy and tolerability of aromatase inhibitors in the extended adjuvant setting. Among these, the large, double-blind, randomized, placebo-controlled MA.17 trial has already demonstrated a significant benefit of letrozole when compared with placebo on disease-free survival in postmenopausal women previously treated for 4.5-6 years with tamoxifen. A smaller open-label trial, the Austrian Breast and Colorectal Cancer Study Group 6a has reported a significant benefit for anastrozole on recurrence when used as extended adjuvant therapy when compared with no treatment, and similar results have been seen with extended adjuvant exemestane in the National Surgical Adjuvant Breast and Bowel Project B-33 trial. The results of these trials have important clinical implications for the future of extended adjuvant hormonal therapy for breast cancer.",-1,1,1,"The study focuses on postmenopausal women with hormone-responsive breast cancer, not colorectal cancer.",The study examines the use and effect of anastrozole as extended adjuvant therapy in breast cancer patients.,The study describes the effect of anastrozole treatment on recurrence in the extended adjuvant setting.
25779024,Experimental and molecular pathology,2015,Jun,,"Linking the ceramide synthases (CerSs) 4 and 5 with apoptosis, endometrial and colon cancers.","Journal Article, Research Support, Non-U.S. Gov't","Rahaba Mojakgomo, Zukile Mbita, Zodwa Dlamini","Ceramide synthases (CerSs) also known as Longevity Assurance (LASS) genes belong to a family of six related genes. CerS gene products have been shown to produce ceramide, hence their name CerSs. Ceramide is a bio-effector molecule, belonging to the family of sphingolipids (SLs), which are important components of cell membranes, and has been implicated in cancer and apoptosis. Cancer still remains the second leading cause of death, both globally and in South Africa. The proper regulation of the balance between cell growth and cell death is essential for cellular homeostasis. Failure to properly regulate this balance may lead to pathologic conditions such as cancer development. CerSs have been implicated in cancer biology, especially in apoptosis, through the action of ceramide. Although knowledge of the role that CerSs play in cancer biology is advancing, the precise roles of distinct CerSs in different cancers are not yet fully understood, especially the roles of CerS4 and CerS5 in endometrial and colon cancers. The aim of this study was to investigate the link of CerS4 and CerS5 in apoptosis and, thus in cancers of the endometrium and colon, which are amongst the most prevalent cancers globally. Apoptosis was induced using anastrozole in endometrial cells and 5-FU in colon cells. Fluorescence activated cell sorting was used to analyse and quantify apoptosis and total RNA was extracted from both treated and untreated cells. Quantitative relative expression of CerS4 and CerS5 mRNA was then determined in all cells (treated and untreated), normalised to β-actin. Bio-informatics was used to compare CerS4 and CerS5 sequences. The endometrial cancer cells were more prone to apoptosis compared to their non-cancerous counterparts, while the colon cancer cells were more responsive to apoptosis induction after 48h, especially the HT-29 cells. Using quantitative real-time PCR, both CerS4 and CerS5 were shown to be up-regulated in endometrial and colon cancer cells. Apoptosis induction resulted in down-regulation of CerS4 and CerS5 in endometrial and colon cancers. These findings implicate these genes in cancer and apoptosis. Whether these genes play pro- or anti-apoptotic roles in cancers of the endometrium and colon is not conclusive at this stage. It may also be possible that these genes could exert opposing roles in the same or different tissues. Targeting this family of genes and understanding their precise individual roles in different types of cancer, are a promising therapeutic tool to new anti-cancer drug discovery or improving existing treatments.",1,1,1,"The study investigates colon cancer cells, which are part of colorectal cancer.","Anastrozole is used to induce apoptosis in endometrial cells, indicating its examination as a treatment.",The study describes the effect of anastrozole treatment on apoptosis and the regulation of CerS4 and CerS5.
20851802,Clinical & translational oncology : official publication of the Federation of Spanish Oncology Societies and of the National Cancer Institute of Mexico,2010,Sep,,Optimal adjuvant hormonal therapy in postmenopausal women with hormone-receptor-positive early breast cancer: have we answered the question?,"Journal Article, Research Support, Non-U.S. Gov't, Review","Alfonso Sánchez-Muñoz, Nuria Ribelles, Emilio Alba","Adjuvant endocrine therapy is the most important systemic treatment for postmenopausal women with hormone-receptor-positive early breast cancer following surgery. Most trials have shown that the third-generation aromatase inhibitors, anastrozole, letrozole (LET), and exemestane, significantly prolong disease-free survival compared with tamoxifen. However, an overall survival benefit with aromatase inhibitors was observed in only three trials to date, in retrospective analyses from selected groups of patients: sequential analysis in the Austrian Breast & Colorectal Study Group 8, switch analysis in the Intergroup Exemestane Study, and analysis of initial letrozole in Breast International Group 1-98 study. Although the priming effect observed in preclinical models and breast cancer patients provides a rationale for sequencing adjuvant endocrine treatment with tamoxifen and aromatase inhibitors, the optimal strategy for adjuvant endocrine treatment has yet to be determined. This review discusses aromatase inhibitor monotherapy, sequential adjuvant treatment with tamoxifen followed by an aromatase inhibitor, and sequential adjuvant treatment with an aromatase inhibitor followed by tamoxifen. Available data in support of and against each strategy is evaluated. The safety profiles of tamoxifen and aromatase inhibitors is also examined.",-1,1,1,"The study focuses on postmenopausal women with hormone-receptor-positive early breast cancer, not colorectal cancer.",The study examines the use and effect of anastrozole as part of adjuvant endocrine therapy in breast cancer patients.,The study describes the effect of anastrozole treatment in comparison with tamoxifen and in different sequencing strategies.
18073378,Journal of the National Cancer Institute,2007,Dec,19,Extended adjuvant therapy with anastrozole among postmenopausal breast cancer patients: results from the randomized Austrian Breast and Colorectal Cancer Study Group Trial 6a.,"Journal Article, Multicenter Study, Randomized Controlled Trial, Research Support, Non-U.S. Gov't","Raimund Jakesz, Richard Greil, Michael Gnant, Marianne Schmid, Werner Kwasny, Ernst Kubista, Brigitte Mlineritsch, Christoph Tausch, Michael Stierer, Friedrich Hofbauer, Karl Renner, Christian Dadak, Ernst Rücklinger, Hellmut Samonigg,  ","Clinical trial data have shown that among breast cancer patients who were disease free after 5 years of adjuvant treatment with tamoxifen, further extended treatment with the nonsteroidal aromatase inhibitor letrozole reduces breast cancer recurrence. We examined the efficacy and tolerability of extended adjuvant therapy with another aromatase inhibitor, anastrozole, for 3 years among women who had completed 5 years of adjuvant therapy.
Austrian Breast and Colorectal Cancer Study Group (ABCSG) Trial 6a is an extension of ABCSG Trial 6, in which hormone receptor-positive postmenopausal patients received 5 years of adjuvant tamoxifen, with or without the aromatase inhibitor aminoglutethimide, for the first 2 years of therapy. For ABCSG Trial 6a, patients who were disease free at the end of Trial 6 were randomly assigned to receive either 3 years of anastrozole or no further treatment. Efficacy data were analyzed with the use of a Cox proportional hazards regression model with two-sided P values and Kaplan-Meier curves, and tolerability data were estimated using logistic regression analysis with odds ratios and 95% confidence intervals (CIs).
ABCSG Trial 6a included 856 patients. At a median follow-up of 62.3 months, women who received anastrozole (n = 387) had a statistically significantly reduced risk of recurrence (locoregional recurrence, contralateral breast cancer, or distant metastasis) compared with women who received no further treatment (n = 469; hazard ratio = 0.62; 95% CI = 0.40 to 0.96, P = .031). Anastrozole was well tolerated, and no unexpected adverse events were reported.
These data confirm the benefit of extending adjuvant tamoxifen therapy beyond 5 years with anastrozole compared with no further treatment. Further research is required to define the optimum length of extended adjuvant therapy and to investigate the possibility of tailoring this period to suit different disease types.",-1,1,1,"The study focuses on postmenopausal breast cancer patients, not colorectal cancer patients.",The study examines the use and effect of anastrozole as extended adjuvant therapy among breast cancer patients.,"The study describes the effect of anastrozole treatment, showing a reduced risk of recurrence with anastrozole compared to no further treatment."
21998336,Clinical cancer research : an official journal of the American Association for Cancer Research,2011,Dec,15,Adjuvant sequencing of tamoxifen and anastrozole is superior to tamoxifen alone in postmenopausal women with low proliferating breast cancer.,Journal Article,"Zsuzsanna Bago-Horvath, Margaretha Rudas, Peter Dubsky, Raimund Jakesz, Christian F Singer, Ralf Kemmerling, Richard Greil, Andrea Jelen, Gerhard Böhm, Zerina Jasarevic, Anton Haid, Christine Gruber, Sabine Pöstlberger, Martin Filipits, Michael Gnant,  ","To assess the predictive value of Ki67 expression in postmenopausal hormone receptor-positive early-breast cancer patients, who were either treated with adjuvant tamoxifen (TAM) alone or with TAM followed by anastrozole (ANA).
Expression of Ki67 was determined centrally by immunohistochemistry on whole tissue sections of postmenopausal endocrine-responsive breast cancers from patients who had been enrolled in the prospectively randomized Austrian Breast and Colorectal Cancer Study Group Trial 8, and had received TAM for 5 years, or TAM for 2 years followed by ANA for 3 years. Ki67 expression was evaluated both as a continuous variable and dichotomized to low (≤10%) and high (>10%). Recurrence-free survival (RFS) and overall survival (OS) were analyzed using Cox models adjusted for clinical and pathologic parameters.
Patients with a high Ki67 expression (394/1,587; 23%) had a significantly shorter RFS (adjusted HR for recurrence = 1.90, 95% CI: 1.37-2.64, P = 0.0001) and OS (adjusted HR for death = 1.78, 95% CI: 1.18-2.70, P = 0.006). In women with breast tumors expressing medium or high ER levels (n = 1,438), the interaction between Ki67 and adjuvant endocrine treatment was significant for RFS (P = 0.03). TAM followed by ANA was superior to TAM alone in patients with low Ki67 (adjusted HR = 0.53, 95% CI: 0.34-0.83, P = 0.005) but not in high Ki67 disease (adjusted HR = 1.18, 95% CI: 0.66-1.89, P = 0.68).
Adjuvant sequencing of TAM and ANA is superior to TAM alone, particularly in postmenopausal women with medium or high ER expressing, low proliferating breast cancer.",-1,1,1,"The study focuses on postmenopausal women with breast cancer, not colorectal cancer.",The study examines the use of Anastrozole in combination with Tamoxifen as an adjuvant treatment.,The study describes the effect of Anastrozole treatment in improving recurrence-free survival in patients with low Ki67 expression.
18718815,The Lancet. Oncology,2008,Sep,,Adjuvant endocrine therapy plus zoledronic acid in premenopausal women with early-stage breast cancer: 5-year follow-up of the ABCSG-12 bone-mineral density substudy.,"Clinical Trial, Phase III, Journal Article, Multicenter Study, Randomized Controlled Trial, Research Support, Non-U.S. Gov't","Michael Gnant, Brigitte Mlineritsch, Gero Luschin-Ebengreuth, Franz Kainberger, Helmut Kässmann, Jutta Claudia Piswanger-Sölkner, Michael Seifert, Ferdinand Ploner, Christian Menzel, Peter Dubsky, Florian Fitzal, Vesna Bjelic-Radisic, Günther Steger, Richard Greil, Christian Marth, Ernst Kubista, Hellmut Samonigg, Peter Wohlmuth, Martina Mittlböck, Raimund Jakesz,  ","The Austrian Breast and Colorectal Cancer Study Group trial-12 (ABCSG-12) bone substudy assesses zoledronic acid for preventing bone loss associated with adjuvant endocrine therapy and reports on long-term findings of bone-mineral density (BMD) during 3 years of treatment and 2 years after completing adjuvant treatment with or without zoledronic acid. The aim of this substudy is to gain insight into bone health in this setting.
ABCSG-12 is a randomised, open-label, phase III, 4-arm trial comparing tamoxifen (20 mg/day orally) and goserelin (3.6 mg subcutaneously every 28 days) versus anastrozole (1 mg/day orally) and goserelin (3.6 mg subcutaneously every 28 days), both with or without zoledronic acid (4 mg intravenously every 6 months) for 3 years in premenopausal women with endocrine-responsive breast cancer. This prospective bone subprotocol measured BMD at 0, 6, 12, 36, and 60 months. The primary endpoint of the bone substudy (secondary endpoint in the main trial) was change in BMD at 12 months, assessed by dual-energy X-ray absorptiometry in assessable patients. Analyses were intention to treat. Statistical significance was assessed by t tests. The ABCSG-12 trial is registered on the ClinicalTrials.gov website, number NCT00295646.
404 patients were prospectively included in the bone substudy and randomly assigned to endocrine therapy alone (goserelin and anastrozole or goserelin and tamoxifen; n=199) or endocrine therapy concurrent with zoledronic acid (goserelin, anastrozole, and zoledronic acid or goserelin, tamoxifen, and zoledronic acid; n=205). After 3 years of treatment, endocrine therapy alone caused significant loss of BMD at the lumbar spine (-11.3%, mean difference -0.119 g/cm(2) [95% CI -0.146 to -0.091], p<0.0001) and trochanter (-7.3%, mean difference -0.053 g/cm(2) [-0.076 to -0.030], p<0.0001). In patients who did not receive zoledronic acid, anastrozole caused greater BMD loss than tamoxifen at 36 months at the lumbar spine (-13.6%, mean difference -0.141 g/cm(2) [-0.179 to -0.102] vs -9.0%, mean difference -0.095 g/cm(2) [-0.134 to -0.057], p<0.0001 for both). 2 years after the completion of treatment (median follow-up 60 months [range 15.5-96.6]), patients not receiving zoledronic acid still had decreased BMD at both sites compared with baseline (lumbar spine -6.3%, mean difference -0.067 g/cm(2) [-0.106 to -0.027], p=0.001; trochanter -4.1%, mean difference -0.03 g/cm(2) [-0.062 to 0.001], p=0.058). Patients who received zoledronic acid had stable BMD at 36 months (lumbar spine +0.4%, mean difference 0.004 g/cm(2) [-0.024 to 0.032]; trochanter +0.8%, mean difference 0.006 g/cm(2) [-0.018 to 0.028]) and increased BMD at 60 months at both sites (lumbar spine +4.0%, mean difference 0.039 g/cm(2) [0.005-0.075], p=0.02; trochanter +3.9%, mean difference 0.028 g/cm(2) [0.003-0.058], p=0.07) compared with baseline.
Goserelin plus tamoxifen or anastrozole for 3 years without concomitant zoledronic acid caused significant bone loss. Although there was partial recovery 2 years after completing treatment, patients receiving endocrine therapy alone did not recover their baseline BMD levels. Concomitant zoledronic acid prevented bone loss during therapy and improved BMD at 5 years.",-1,1,1,"The study focuses on premenopausal women with early-stage breast cancer, not colorectal cancer.",The study examines the use of anastrozole as part of adjuvant endocrine therapy in premenopausal women with breast cancer.,"The study describes the effect of anastrozole treatment on bone mineral density, showing greater BMD loss compared to tamoxifen in patients not receiving zoledronic acid."
34320285,The New England journal of medicine,2021,Jul,29,Duration of Adjuvant Aromatase-Inhibitor Therapy in Postmenopausal Breast Cancer.,"Clinical Trial, Phase III, Journal Article, Multicenter Study, Randomized Controlled Trial, Research Support, Non-U.S. Gov't","Michael Gnant, Florian Fitzal, Gabriel Rinnerthaler, Guenther G Steger, Sigrun Greil-Ressler, Marija Balic, Dietmar Heck, Raimund Jakesz, Josef Thaler, Daniel Egle, Diether Manfreda, Vesna Bjelic-Radisic, Ursula Wieder, Christian F Singer, Elisabeth Melbinger-Zeinitzer, Ferdinand Haslbauer, Paul Sevelda, Harald Trapl, Viktor Wette, Kerstin Wimmer, Simon P Gampenrieder, Rupert Bartsch, Stephanie Kacerovsky-Strobl, Christoph Suppan, Christine Brunner, Christine Deutschmann, Lidija Soelkner, Christian Fesl, Richard Greil,  ","For postmenopausal women with hormone-receptor-positive breast cancer, the most effective duration for adjuvant therapy with an aromatase inhibitor remains unclear.
In this prospective, phase 3 trial, we randomly assigned postmenopausal women with hormone-receptor-positive breast cancer who had received 5 years of adjuvant endocrine therapy to receive the aromatase inhibitor anastrozole for an additional 2 years (2-year group, receiving a total of 7 years) or an additional 5 years (5-year group, receiving a total of 10 years). The primary end point was disease-free survival. The primary analysis included all the patients who were still participating in the trial and who had no recurrence 2 years after randomization (i.e., when treatment in the 2-year group had ended). Secondary end points were overall survival, contralateral breast cancer, second primary cancer, and clinical bone fracture.
Among the 3484 women who were enrolled in the trial, 3208 remained in the trial without disease progression after the first 2 years of extended anastrozole treatment following randomization. Among these women, disease progression or death occurred in 335 women in each treatment group in the primary-analysis set at 8 years (hazard ratio, 0.99; 95% confidence interval [CI], 0.85 to 1.15; P = 0.90). No between-group differences occurred in most secondary end points, and subgroup analyses did not indicate differences in any particular subgroup. The risk of clinical bone fracture was higher in the 5-year group than in the 2-year group (hazard ratio, 1.35; 95% CI, 1.00 to 1.84).
In postmenopausal women with hormone-receptor-positive breast cancer who had received 5 years of adjuvant endocrine therapy, extending hormone therapy by 5 years provided no benefit over a 2-year extension but was associated with a greater risk of bone fracture. (Funded by AstraZeneca and the Austrian Breast and Colorectal Cancer Study Group; ABCSG-16/SALSA ClinicalTrials.gov number, NCT00295620.).",-1,1,1,"The study focuses on postmenopausal women with hormone-receptor-positive breast cancer, not colorectal cancer.",The study examines the use of anastrozole as an adjuvant aromatase inhibitor in postmenopausal women with breast cancer.,"The study describes the effect of anastrozole treatment, comparing 2-year and 5-year extensions of therapy, including outcomes such as disease-free survival and bone fractures."
