PMID,Journal,Year,Month,Day,Title,Publication Type,Authors,Abstract,s1,s2,s3,r1,r2,r3
24347518,Annals of oncology : official journal of the European Society for Medical Oncology,2014,Feb,,Predicting distant recurrence in receptor-positive breast cancer patients with limited clinicopathological risk: using the PAM50 Risk of Recurrence score in 1478 postmenopausal patients of the ABCSG-8 trial treated with adjuvant endocrine therapy alone.,"Journal Article, Research Support, Non-U.S. Gov't","M Gnant, M Filipits, R Greil, H Stoeger, M Rudas, Z Bago-Horvath, B Mlineritsch, W Kwasny, M Knauer, C Singer, R Jakesz, P Dubsky, F Fitzal, R Bartsch, G Steger, M Balic, S Ressler, J W Cowens, J Storhoff, S Ferree, C Schaper, S Liu, C Fesl, T O Nielsen,  ","PAM50 is a 50-gene test that is designed to identify intrinsic breast cancer subtypes and generate a Risk of Recurrence (ROR) score. It has been developed to be carried out in qualified routine hospital pathology laboratories.
One thousand four hundred seventy-eight postmenopausal women with estrogen receptor (ER)+ early breast cancer (EBC) treated with tamoxifen or tamoxifen followed by anastrozole from the prospective randomized ABCSG-8 trial were entered into this study. Patients did not receive adjuvant chemotherapy. RNA was extracted from paraffin blocks and analyzed using the PAM50 test. Both intrinsic subtype (luminal A/B, HER2-enriched, basal-like) and ROR score were calculated. The primary analysis was designed to test whether the continuous ROR score adds prognostic value in predicting distant recurrence (DR) over and above standard clinical variables.
In all tested subgroups, ROR score significantly adds prognostic information to the clinical predictor (P<0.0001). PAM50 assigns an intrinsic subtype to all cases, and the luminal A cohort had a significantly lower ROR at 10 years compared with Luminal B (P<0.0001). Significant and clinically relevant discrimination between low- and high-risk groups occurred also within all tested subgroups.
The results of the primary analysis, in combination with recently published results from the ATAC trial, constitute Level 1 evidence for clinical validity of the PAM50 test for predicting the risk of DR in postmenopausal women with ER+ EBC. A 10-year metastasis risk of <3.5% in the ROR low category makes it unlikely that additional chemotherapy would improve this outcome-this finding could help to avoid unwarranted overtreatment.
ABCSG 8: NCT00291759.",-1,1,1,"The study focuses on postmenopausal women with estrogen receptor-positive breast cancer, not colorectal cancer.",The study examines the use of Anastrozole as part of adjuvant endocrine therapy in postmenopausal women with ER+ early breast cancer.,The study describes the effect of Anastrozole treatment in combination with tamoxifen and its impact on distant recurrence risk in breast cancer patients.
21087898,The Lancet. Oncology,2010,Dec,,Effect of anastrozole and tamoxifen as adjuvant treatment for early-stage breast cancer: 10-year analysis of the ATAC trial.,"Journal Article, Randomized Controlled Trial, Research Support, Non-U.S. Gov't","Jack Cuzick, Ivana Sestak, Michael Baum, Aman Buzdar, Anthony Howell, Mitch Dowsett, John F Forbes,  ","The Arimidex, Tamoxifen, Alone or in Combination (ATAC) trial was designed to compare the efficacy and safety of anastrozole (1 mg) with tamoxifen (20 mg), both given orally every day for 5 years, as adjuvant treatment for postmenopausal women with early-stage breast cancer. In this analysis, we assess the long-term outcomes after a median follow-up of 120 months.
We used a proportional hazards model to assess the primary endpoint of disease-free survival, and the secondary endpoints of time to recurrence, time to distant recurrence, incidence of new contralateral breast cancer, overall survival, and death with or without recurrence in all randomised patients (anastrozole n=3125, tamoxifen n=3116) and hormone-receptor-positive patients (anastrozole n=2618, tamoxifen n=2598). After treatment completion, we continued to collect data on fractures and serious adverse events in a masked fashion (safety population: anastrozole n=3092, tamoxifen n=3094). This study is registered as an International Standard Randomised Controlled Trial, number ISRCTN18233230.
Patients were followed up for a median of 120 months (range 0-145); there were 24,522 woman-years of follow-up in the anastrozole group and 23,950 woman-years in the tamoxifen group. In the full study population, there were significant improvements in the anastrozole group compared with the tamoxifen group for disease-free survival (hazard ratio [HR] 0·91, 95% CI 0·83-0·99; p=0·04), time to recurrence (0·84, 0·75-0·93; p=0·001), and time to distant recurrence (0·87, 0·77-0·99; p=0·03). For hormone-receptor-positive patients, the results were also significantly in favour of the anastrozole group for disease-free survival (HR 0·86, 95% CI 0·78-0·95; p=0·003), time to recurrence (0·79, 0·70-0·89; p=0·0002), and time to distant recurrence (0·85, 0·73-0·98; p=0·02). In hormone-receptor-positive patients, absolute differences in time to recurrence between anastrozole and tamoxifen increased over time (2·7% at 5 years and 4·3% at 10 years) and recurrence rates remained significantly lower on anastrozole than tamoxifen after treatment completion (HR 0·81, 95% CI 0·67-0·98; p=0·03), although the carryover benefit was smaller after 8 years. There was weak evidence of fewer deaths after recurrence with anastrozole compared with tamoxifen treatment in the hormone-receptor-positive subgroup (HR 0·87, 95% CI 0·74-1·02; p=0·09), but there was little difference in overall mortality (0·95, 95% CI 0·84-1·06; p=0·4). Fractures were more frequent during active treatment in patients receiving anastrozole than those receiving tamoxifen (451 vs 351; OR 1·33, 95% CI 1·15-1·55; p<0·0001), but were similar in the post-treatment follow-up period (110 vs 112; OR 0·98, 95% CI 0·74-1·30; p=0·9). Treatment-related serious adverse events were less common in the anastrozole group than the tamoxifen group (223 anastrozole vs 369 tamoxifen; OR 0·57, 95% CI 0·48-0·69; p<0·0001), but were similar after treatment completion (66 vs 78; OR 0·84, 95% CI 0·60-1·19; p=0·3). No differences in non-breast cancer causes of death were apparent and the incidence of other cancers was similar between groups (425 vs 431) and continue to be higher with anastrozole for colorectal (66 vs 44) and lung cancer (51 vs 34), and lower for endometrial cancer (six vs 24), melanoma (eight vs 19), and ovarian cancer (17 vs 28). No new safety concerns were reported.
These data confirm the long-term superior efficacy and safety of anastrozole over tamoxifen as initial adjuvant therapy for postmenopausal women with hormone-sensitive early breast cancer.",-1,1,1,"The study focuses on postmenopausal women with early-stage breast cancer, not colorectal cancer.",The study examines the use and effect of anastrozole as an adjuvant treatment for breast cancer.,"The study describes the effect of anastrozole treatment on disease-free survival, recurrence, and safety outcomes."
15976552,Current opinion in obstetrics & gynecology,2005,Aug,,"Selective oestrogen receptor modulators, aromatase inhibitors and the female breast.","Journal Article, Review",Anthony Howell,"Tamoxifen has been available for over 20 years and remains the most commonly recognized endocrine therapy. This review was prompted by a wealth of new data on several newer endocrine agents, including selective oestrogen receptor modulators, aromatase inhibitors and a new oestrogen receptor antagonist, fulvestrant, which unlike the selective oestrogen receptor modulators has no oestrogen agonist effects.
Completed analysis of the 'Arimidex', Tamoxifen, Alone or in Combination trial demonstrated that anastrozole as initial adjuvant therapy significantly improved disease-free survival and time to recurrence compared with tamoxifen, as well as reducing the incidence of contralateral breast cancer deaths. The Italian Tamoxifen Anastrozole trial and the Austrian Breast and Colorectal Cancer Study Group 8/Arimidex Nolvadex 95 trial have indicated that anastrozole may also be beneficial in women who have already received 2-3 years of tamoxifen. Similarly, the Intergroup Exemestane Study demonstrated the efficacy of exemestane in this setting. Women who have completed a full 5-year course of tamoxifen may also benefit from aromatase inhibitor treatment as indicated by the MA 17 trial, which investigated letrozole as extended adjuvant therapy. Fulvestrant is effective in tamoxifen-resistant disease, and phase II trial data suggest that fulvestrant may also be effective following aromatase inhibitor failure.
The introduction of the third-generation aromatase inhibitors has caused a paradigm shift in adjuvant endocrine treatment. Research into the optimal use of selective oestrogen receptor modulators continues and the evidence base for fulvestrant, the first in a new class of endocrine agents, continues to grow, confirming its value in the treatment of hormone-responsive breast cancer.",-1,1,1,"The paper focuses on breast cancer, not colorectal cancer.",The paper examines the use and effect of anastrozole in the treatment of breast cancer.,"The paper describes the effect of anastrozole treatment, including improved disease-free survival and reduced recurrence."
9541667,Der Internist,1997,Mar,,[Two new therapeutic principles in the management of breast cancer and colorectal cancer: selective oral aromatase inhibition and thymidilate synthase inhibition].,Journal Article,,,1,1,1,The paper mentions colorectal cancer as one of the cancers discussed in the context of the therapeutic principles.,The paper discusses Anastrozole as a selective oral aromatase inhibitor used in the management of breast and colorectal cancer.,The paper describes the effect of Anastrozole treatment as part of the therapeutic principles for managing colorectal cancer.
38389643,Cureus,2024,Jan,,Therapeutic Effects of CDK4/6 Inhibitors in Gastric and Colonic Metastases From Breast Cancer: A Case Report.,"Case Reports, Journal Article","Akinori Sasaki, Shuko Masuda, Tsubasa Yoshioka, Akira Saito, Yasuaki Motomura","Breast cancer often metastasizes to the lungs, bones, liver, and brain; however, gastric and colonic metastases from breast cancer are rare. Nevertheless, here, we present the case of a 50-year-old woman diagnosed with recurrent breast cancer, exhibiting gastric and colonic metastases that were detected when she experienced intermittent abdominal pain. The differentiation between primary gastric cancer and metastasis from breast cancer was made through immunohistochemical staining. The patient underwent treatment with palbociclib, a cyclin-dependent kinase (CDK)4/6 inhibitor, and anastrozole, with no significant adverse effects. Subsequent upper and lower endoscopic examinations following the initiation of these treatments revealed tumor shrinkage in both gastric and colonic metastases. This case report presents the first instance in which morphological changes in gastrointestinal metastasis induced by CDK4/6 inhibitors could be evaluated.",-1,1,1,"The study focuses on gastric and colonic metastases from breast cancer, not colorectal cancer.",The study examines the use of anastrozole as part of the treatment regimen.,"The study describes the effect of anastrozole treatment in combination with palbociclib, noting tumor shrinkage in gastric and colonic metastases."
23074401,Ontario health technology assessment series,2010,,,Gene expression profiling for guiding adjuvant chemotherapy decisions in women with early breast cancer: an evidence-based and economic analysis.,Journal Article, ,"In February 2010, the Medical Advisory Secretariat (MAS) began work on evidence-based reviews of published literature surrounding three pharmacogenomic tests. This project came about when Cancer Care Ontario (CCO) asked MAS to provide evidence-based analyses on the effectiveness and cost-effectiveness of three oncology pharmacogenomic tests currently in use in Ontario.Evidence-based analyses have been prepared for each of these technologies. These have been completed in conjunction with internal and external stakeholders, including a Provincial Expert Panel on Pharmacogenomics (PEPP). Within the PEPP, subgroup committees were developed for each disease area. For each technology, an economic analysis was also completed by the Toronto Health Economics and Technology Assessment Collaborative (THETA) and is summarized within the reports.THE FOLLOWING REPORTS CAN BE PUBLICLY ACCESSED AT THE MAS WEBSITE AT: www.health.gov.on.ca/mas or at www.health.gov.on.ca/english/providers/program/mas/mas_about.htmlGENE EXPRESSION PROFILING FOR GUIDING ADJUVANT CHEMOTHERAPY DECISIONS IN WOMEN WITH EARLY BREAST CANCER: An Evidence-Based and Economic AnalysisEpidermal Growth Factor Receptor Mutation (EGFR) Testing for Prediction of Response to EGFR-Targeting Tyrosine Kinase Inhibitor (TKI) Drugs in Patients with Advanced Non-Small-Cell Lung Cancer: An Evidence-Based and Ecopnomic AnalysisK-RAS testing in Treatment Decisions for Advanced Colorectal Cancer: an Evidence-Based and Economic Analysis
To review and synthesize the available evidence regarding the laboratory performance, prognostic value, and predictive value of Oncotype-DX for the target population.
CONDITION AND TARGET POPULATION The target population of this review is women with newly diagnosed early stage (stage I-IIIa) invasive breast cancer that is estrogen-receptor (ER) positive and/or progesterone-receptor (PR) positive. Much of this review, however, is relevant for women with early stage (I and II) invasive breast cancer that is specifically ER positive, lymph node (LN) negative and human epidermal growth factor receptor 2 (HER-2/neu) negative. This refined population represents an estimated incident population of 3,315 new breast cancers in Ontario (according to 2007 data). Currently it is estimated that only 15% of these women will develop a distant metastasis at 10 years; however, a far great proportion currently receive adjuvant chemotherapy, suggesting that more women are being treated with chemotherapy than can benefit. There is therefore a need to develop better prognostic and predictive tools to improve the selection of women that may benefit from adjuvant chemotherapy. TECHNOLOGY OF CONCERN: The Oncotype-DX Breast Cancer Assay (Genomic Health, Redwood City, CA) quantifies gene expression for 21 genes in breast cancer tissue by performing reverse transcription polymerase chain reaction (RT-PCR) on formalin-fixed paraffin-embedded (FFPE) tumour blocks that are obtained during initial surgery (lumpectomy, mastectomy, or core biopsy) of women with early breast cancer that is newly diagnosed. The panel of 21 genes include genes associated with tumour proliferation and invasion, as well as other genes related to HER-2/neu expression, ER expression, and progesterone receptor (PR) expression.
What is the laboratory performance of Oncotype-DX?How reliable is Oncotype-DX (i.e., how repeatable and reproducible is Oncotype-DX)?How often does Oncotype-DX fail to give a useable result?What is the prognostic value of Oncotype-DX?Is Oncotype-DX recurrence score associated with the risk of distant recurrence or death due to any cause in women with early breast cancer receiving tamoxifen?What is the predictive value of Oncotype-DX?Does Oncoytpe-DX recurrence score predict significant benefit in terms of improvements in 10-year distant recurrence or death due to any cause for women receiving tamoxifen plus chemotherapy in comparison to women receiving tamoxifen alone?How does Oncotype-DX compare to other known predictors of risk such as Adjuvant! Online?How does Oncotype-DX impact patient quality of life and clinical/patient decision-making?
A literature search was performed on March 19(th), 2010 using OVID MEDLINE, MEDLINE In-Process and Other Non-Indexed Citations, EMBASE, the Cumulative Index to Nursing & Allied Health Literature (CINAHL), the Cochrane Library, and the International Agency for Health Technology Assessment (INAHTA) for studies published from January 1(st), 2006 to March 19(th), 2010. A starting search date of January 1(st), 2006 was because a comprehensive systematic review of Oncotype-DX was identified in preliminary literature searching. This systematic review, by Marchionni et al. (2008), included literature up to January 1(st), 2007. All studies identified in the review by Marchionni et al. as well as those identified in updated literature searching were used to form the evidentiary base of this review. The quality of the overall body of evidence was identified as high, moderate, low or very low according to GRADE methodology.
Any observational trial, controlled clinical trial, randomized controlled trial (RCT), meta-analysis or systematic review that reported on the laboratory performance, prognostic value and/or predictive value of Oncotype-DX testing, or other outcome relevant to the Key Questions, specific to the target population was included.
Studies that did not report original data or original data analysis,Studies published in a language other than English,Studies reported only in abstract or as poster presentations (such publications were not sought nor included in this review since the MAS does not generally consider evidence that is not subject to peer review nor does the MAS consider evidence that lacks detailed description of methodology).
Outcomes of interest varied depending on the Key Question. For the Key Questions of prognostic and predictive value (Key Questions #2 and #3), the prospectively defined primary outcome was risk of 10-year distant recurrence. The prospectively defined secondary outcome was 10-year death due to any cause (i.e., overall survival). All additional outcomes such as risk of locoregional recurrence or disease-free survival (DFS) were not prospectively determined for this review but were reported as presented in included trials; these outcomes are referenced as tertiary outcomes in this review. Outcomes for other Key Questions (i.e., Key Questions #1, #4 and #5) were not prospectively defined due to the variability in endpoints relevant for these questions.
A total of 26 studies were included. Of these 26 studies, only five studies were relevant to the primary questions of this review (Key Questions #2 and #3). The following conclusions were drawn from the entire body of evidence: There is a lack of external validation to support the reliability of Oncotype-DX; however, the current available evidence derived from internal industry validation studies suggests that Oncotype-DX is reliable (i.e., Oncotype-DX is repeatable and reproducible).Current available evidence suggests a moderate failure rate of Oncotype-DX testing; however, the failure rate observed across clinical trials included in this review is likely inflated; the current Ontario experience suggests an acceptably lower rate of test failure.In women with newly diagnosed early breast cancer (stage I-II) that is estrogen-receptor positive and/or progesterone-receptor positive and lymph-node negative:There is low quality evidence that Oncotype-DX has prognostic value in women who are being treated with adjuvant tamoxifen or anastrozole (the latter for postmenopausal women only),There is very low quality evidence that Oncotype-DX can predict which women will benefit from adjuvant CMF/MF chemotherapy in women being treated with adjuvant tamoxifen.In postmenopausal women with newly diagnosed early breast cancer that is estrogen-receptor positive and/or progesterone-receptor positive and lymph-node positive:There is low quality evidence that Oncotype-DX has limited prognostic value in women who are being treated with adjuvant tamoxifen or anastrozole,There is very low quality evidence that Oncotype-DX has limited predictive value for predicting which women will benefit from adjuvant CAF chemotherapy in women who are being treated with adjuvant tamoxifen.There are methodological and statistical limitations that affect both the generalizability of the current available evidence, as well as the magnitude and statistical strength of the observed effect sizes; in particular:Of the major predictive trials, Oncotype-DX scores were only produced for a small subset of women (<40% of the original randomized population) potentially disabling the effects of treatment randomization and opening the possibility of selection bias;Data is not specific to HER-2/neu-negative women;There were limitations with multivariate statistical analyses.Additional trials of observational design may provide further validation of the prognostic and predictive value of Oncotype-DX; however, it is unlikely that prospective or randomized data will become available in the near future due to ethical, time and resource considerations.There is currently insufficient evidence investigating how Oncoytpe-DX compares to other known prognostic estimators of risk, such as Adjuvant! Online, and there is insufficient evidence investigating how Oncotype-DX would impact clinician/patient decision-making in a setting generalizable to Ontario.",-1,-1,0,"The study focuses on women with early breast cancer, not colorectal cancer.","The study examines the use of tamoxifen and anastrozole, but anastrozole is not the main treatment focus of the study.",The study mentions anastrozole in the context of treatment but does not describe its specific effects in detail.
20705558,Clinical breast cancer,2010,Aug,01,Cost-effectiveness of zoledronic acid plus endocrine therapy in premenopausal women with hormone-responsive early breast cancer.,"Journal Article, Research Support, Non-U.S. Gov't","Thomas E Delea, Charu Taneja, Oleg Sofrygin, Satyin Kaura, Michael Gnant","The aim of this study was to estimate the cost-effectiveness of adding zoledronic acid 4 mg intravenously every 6 months to endocrine therapy in premenopausal women with hormone receptor-positive early breast cancer from a US health care system perspective.
A Markov model was developed to predict disease progression, mortality, and costs of breast cancer care for premenopausal women with hormone receptor-positive early breast cancer receiving up to 3 years of (1) endocrine therapy (goserelin plus tamoxifen or anastrozole); or (2) endocrine therapy plus zoledronic acid. Model parameters were obtained from ABCSG-12 (Austrian Breast and Colorectal Cancer Study Group Trial-12) and the literature. The incremental cost per quality-adjusted life year (QALY) gained with zoledronic acid was calculated under 2 scenarios: (1) benefits of zoledronic acid persist to maximum (7 years) follow-up in ABCSG-12 (""trial benefits"") or (2) benefits persist until death (""lifetime benefits"").
Adding zoledronic acid to endocrine therapy was projected to yield a gain of 0.41 life years (LYs) and 0.43 QALYs assuming trial benefits and 1.34 LYs and 1.41 QALYs assuming lifetime benefits. Assuming trial benefits, the incremental cost per QALY gained with zoledronic acid was $9300. Assuming lifetime benefits, zoledronic acid was estimated to increase QALYs and reduce costs. Cost per QALY gained was <or= $56,000 in all deterministic sensitivity analyses and was <or= $50,000 in 94% and 97% of probabilistic sensitivity analyses for trial and lifetime benefits scenarios, respectively.
Adding zoledronic acid to endocrine therapy in premenopausal women with hormone receptor-positive early breast cancer is cost-effective from a US health care system perspective.",-1,1,1,"The study focuses on premenopausal women with hormone receptor-positive early breast cancer, not Colorectal cancer.",The study examines anastrozole as part of endocrine therapy in combination with zoledronic acid.,The study describes the effect of anastrozole as part of endocrine therapy in a model comparing treatment outcomes.
23050408,Vojnosanitetski pregled,2012,Sep,,Uncommon metastatic site from breast cancer.,"Case Reports, Journal Article","Ivan Nikolić, Tatjana Ivković-Kapicl, Biljana Kukić, Bogdan Bogdanović, Tomislav Petrović, Igor Djan, Dragana Smiljenić","Breast cancer is one of the most common malignancies in women and the main leading cause of cancer death. The most frequent sites of metastases from breast cancer are bones, lungs, the central nervous system, the liver and soft tissue. Colonic metastases from breast cancer are rare.
We presented a 70-year-old woman with bulky obstructing lesion of sigmoid colon. A physician in charge on our department examined the patient and past history of breast cancer was found up. Surgery was performed with removal of sigmoid colon and three of six lymph nodes were positive. Pathological examination, including immunohistochemical stains, confirmed the diagnosis of metastatic breast cancer to sigmoid colon. The multidisciplinary oncology team suggested postoperative chemotherapy. The patient received four cycles of chemotherapy with paclitaxel followed by anastrozole. On the first control visit no disease activity was detected.
In patients with the past history of breast cancer the symptoms of hematochezia or anemia may indicate colonic metastases.",-1,1,1,"The study focuses on a patient with metastatic breast cancer to the colon, not patients with primary colorectal cancer.",The study describes the use of anastrozole as part of the treatment regimen following chemotherapy.,"The study describes the administration of anastrozole and notes that no disease activity was detected on the first control visit, indicating an effect of the treatment."
