PMID,Journal,Year,Month,Day,Title,Publication Type,Authors,Abstract,s1,s2,s3,r1,r2,r3
37665515,Gastric cancer : official journal of the International Gastric Cancer Association and the Japanese Gastric Cancer Association,2023,Nov,,Efficacy and safety of trifluridine/tipiracil plus ramucirumab in comparison with trifluridine/tipiracil monotherapy for patients with advanced gastric cancer-single institutional experience.,Journal Article,"Mashiro Okunaka, Akihito Kawazoe, Hitomi Nakamura, Daisuke Kotani, Saori Mishima, Yasutoshi Kuboki, Yoshiaki Nakamura, Kohei Shitara","Trifluridine/tipiracil plus VEGF inhibition with ramucirumab (RAM) for advanced gastric cancer (AGC) demonstrated clinical activity with an acceptable toxicity profile in previous phase II trial. However, little is known about its efficacy and safety in clinical practice in comparison with trifluridine/tipiracil monotherapy.
We retrospectively investigated efficacy and safety of trifluridine/tipiracil plus RAM and trifluridine/tipiracil monotherapy as third or later line treatment for AGC patients.
Forty-one patients receiving trifluridine/tipiracil plus RAM and 60 patients receiving trifluridine/tipiracil monotherapy were analyzed. The objective response rate (ORR) and the disease control rate (DCR) were 13.5% and 64.9% in the trifluridine/tipiracil plus RAM group, and 3.8% and 42.3% in the trifluridine/tipiracil monotherapy group, respectively (ORR; P = 0.122, DCR; P = 0.052). The median progression-free survival (PFS) and the median overall survival (OS) were 3.0 months and 7.2 months in the trifluridine/tipiracil plus RAM group, and 1.8 months and 3.8 months in the trifluridine/tipiracil monotherapy group, respectively (HR for PFS = 0.66; P = 0.059, HR for OS = 0.50; P = 0.007). Multivariate analysis showed significantly longer PFS (HR = 0.52; P = 0.011) and OS (HR = 0.51; P = 0.031) in the trifluridine/tipiracil plus RAM group compared to the trifluridine/tipiracil monotherapy group. No unexpected adverse events were observed in both groups.
Trifluridine/tipiracil plus RAM might show favorable anti-tumor activity with an acceptable toxicity profile in comparison with trifluridine/tipiracil monotherapy, suggesting one treatment option for AGC patients in salvage line. The combination needs further evaluation in ongoing randomized trials.",-1,1,1,"The study focuses on patients with advanced gastric cancer, not colorectal cancer.",The study examines the use of Ramucirumab in combination with trifluridine/tipiracil as a treatment for advanced gastric cancer.,The study describes the effect of Ramucirumab treatment by comparing outcomes between the combination therapy and monotherapy groups.
31482405,Journal of gastrointestinal cancer,2020,Jun,,A Complete Response Achieved in a Patient with Hepatic Metastasis from Sigmoid Colon Cancer by a Regimen Containing Ramucirumab: a Case Report.,"Case Reports, Journal Article","Saeko Fukui, Kazuma Kobayashi, Michi Morita, Shinichiro Ito, Yusuke Inoue, Sayaka Kuba, Chika Sakimura, Taiichiro Kosaka, Kuniko Abe, Kosho Yamanouchi, Kengo Kanetaka, Mitsuhisa Takatsuki, Susumu Eguchi",,1,1,1,"The paper describes a patient with sigmoid colon cancer, which is a type of colorectal cancer.",The paper examines the use of Ramucirumab as part of a treatment regimen in a patient with colorectal cancer.,The paper describes the effect of Ramucirumab treatment in achieving a complete response in the patient.
32874533,Therapeutic advances in drug safety,2020,,,Fulminant Fournier's gangrene in a patient with gastric cancer treated with ramucirumab and paclitaxel.,"Case Reports, Journal Article","Zoran Rakusic, Ana Misir Krpan, Ivica Sjekavica","Fournier's gangrene (FG) is an uncommon form of necrotizing fasciitis, localized on the external genital organs, perianal region, and abdominal wall, accompanied by thrombosis of the feeding arteries, leading to gangrene of the skin and subcutaneous tissue, with manifestations of rapid clinical progression and multiple organ failure. Ramucirumab is a recombinant human immunoglobulin G1 monoclonal antibody that binds to the extracellular binding domain of vascular endothelial growth factor receptor-2 (VEGFR-2) and prevents the binding of all VEGFR ligands. The literature describes bevacizumab, aflibercept, and regorafenib associated with FG in patients with colorectal cancer. According to our knowledge this is the first report of FG possibly related to ramucirumab in a patient with gastric cancer. If not recognized in time, it can lead to fatal complications.",-1,1,1,"The study focuses on a patient with gastric cancer, not colorectal cancer.",The study examines the use of ramucirumab in a patient with gastric cancer as part of their treatment regimen.,"The study describes the effect of ramucirumab treatment, noting a possible association with the development of Fournier's gangrene."
32156863,Gan to kagaku ryoho. Cancer & chemotherapy,2019,Dec,,[A Case of Nephrotic Syndrome Induced by FOLFIRI plus Ramucirumab for Metastatic Descending Colon Cancer].,"Case Reports, Journal Article","Tatsushi Shingai, Takayuki Fukuzaki, Shumpei Okimura, Yoshiro Ito, Yoshiki Taniguchi, Tadafumi Fukata, Hisashi Nishida, Osamu Takayama, Setsuko Yoshioka, Shigeyuki Hojo, Hiroaki Ohigashi","We report a case of multiple lung metastases of RAS mutant type descending colon cancer with development of nephrotic syndrome after the introduction of FOLFIRI plus ramucirumab(RAM). A female patient in her 50s underwent adjuvant chemotherapy with capecitabine and oxaliplatin after primary tumor and partial lung resection. For recurrent multiple lung metastases, 4 years of capecitabine and bevacizumab therapy was administered. FOLFIRI plus RAM therapy was introduced because of tumor progression. After treatment, the patient showed increased urine protein content, decreased serum albumin levels, marked hypertension, and increased edema, and was diagnosed with nephrotic syndrome. The patient's condition improved with prednisolone, additional doses of antihypertensive, and diuretics. Even in cases where it is possible to control proteinuria during bevacizumab administration, it is necessary to keep in mind that RAM administration as second-line therapy may cause nephrotic syndrome.",1,1,1,"The paper describes a patient with metastatic descending colon cancer, which is a type of colorectal cancer.",The paper examines the use of Ramucirumab as part of the treatment regimen (FOLFIRI plus RAM) in a patient with colorectal cancer.,"The paper describes the effect of Ramucirumab treatment, specifically the development of nephrotic syndrome as an adverse effect."
41555178,Gan to kagaku ryoho. Cancer & chemotherapy,2026,Jan,,[A Case of Pneumothorax Developing During Ramucirumab Combination Chemotherapy for Ascending Colon Cancer with Multiple Pulmonary Metastases].,"Journal Article, Case Reports, English Abstract","Tomohiko Machida, Shuji Okamoto, Takahiro Nakajima, Yasuhisa Hasegawa, Yasutomo Azumi, Motoki Hiroyoshi, Takahisa Yamamoto","The patient was a 63-year-old woman.In 2014, she underwent surgery for metastatic ovarian cancer, but intraoperative findings revealed peritoneal dissemination.A colonoscopy after surgery revealed a type 2 tumor in the ascending colon, and a biopsy revealed a diagnosis of tub2.After chemotherapy, an ileocecal resection was performed for ascending colon cancer.She subsequently developed multiple lung, liver, and right rib metastases, and in December 2023, FOLFIRI plus RAM therapy was started.In May 2024, a CT scan showed an increase in the right pleural effusion, and she was diagnosed with malignant pleurisy.She underwent thoracic drainage and pleurodesis.FOLFIRI plus RAM therapy was continued, but in August of the same year, she developed nausea and difficulty breathing, and a CT scan revealed a right pneumothorax.The collapse of the right lung was mild, and the patient was admitted to the hospital on an emergency basis and placed on rest.There was no worsening of the pneumothorax, and she was discharged on the 9th day after admission.The mechanism by which the pneumothorax developed in this case was thought to be that intrathoracic pressure increased with nausea and vomiting caused by chemotherapy and increased opioid dosage, leading to the rupture of the pleural dissemination lesion, causing the pneumothorax.",1,1,1,"The paper describes a patient with ascending colon cancer, which is a type of colorectal cancer.",The paper examines the use of Ramucirumab in combination with FOLFIRI as part of the treatment regimen.,"The paper describes the effect of Ramucirumab treatment, specifically in the context of a pneumothorax that occurred during treatment."
37434969,Frontiers in oncology,2023,,,Case Report: Longitudinal monitoring of clonal evolution by circulating tumor DNA for resistance to anti-EGFR antibody in a case of metastatic colorectal cancer.,"Case Reports, Journal Article","Tamotsu Sagawa, Yasushi Sato, Masahiro Hirakawa, Kyoko Hamaguchi, Fumito Tamura, Hiroyuki Nagashima, Koshi Fujikawa, Koichi Okamoto, Yutaka Kawano, Masahiro Sogabe, Hiroshi Miyamoto, Tetsuji Takayama","Treatment with anti-EGFR antibody has been shown to prolong survival in patients with RAS wild-type metastatic colorectal cancer (mCRC). However, even patients who initially respond to anti-EGFR antibody therapy, almost without exception, develop resistance to the therapy and then fail to respond. Secondary mutations in the mitogen-activated protein (MAPK) signaling pathway (mainly in NRAS and BRAF) have been implicated in anti-EGFR resistance. However, the process by which resistant clones develop during therapy has not been elucidated, and considerable intrapatient and interpatient heterogeneity exists. Circulating tumor DNA (ctDNA) testing has recently allowed the noninvasive detection of heterogeneous molecular alterations that underlie the evolution of resistance to anti-EGFR. In this report, we describe our observation of genomic alterations in KRAS and NRAS in a patient with acquired resistance to anti-EGFR antibody drugs by tracking clonal evolution using serial ctDNA anaylsis.
A 54-year-old woman was initially diagnosed with sigmoid colon cancer with multiple liver metastases. After receiving first-line mFOLFOX + cetuximab, second-line FOLFIRI + ramucirumab, third-line trifluridine/tipiracil + bevacizumab, fourth-line regorafenib, and fifth-line CAPOX + bevacizumab, she was rechallenged with CPT-11 + cetuximab. The best response to anti-EGFR rechallenge therapy was a partial response. RAS in the ctDNA was assessed during treatment. The RAS status changed from wild type to mutant type, back to wild type, and again to mutant type (NRAS/KRAS codon 61) during the course of treatment.
In this report, tracking of ctDNA allowed us to describe clonal evolution in a case in which we observed genomic alterations in KRAS and NRAS in a patient who acquired resistance to anti-EGFR antibody drugs during treatment. It is reasonable to consider repeat molecular interrogation during progression in patients with mCRC by using ctDNA analysis, which could help to identify patients who may benefit from a rechallenge strategy.",1,1,0,The study focuses on a patient with metastatic colorectal cancer.,The study examines the use of Ramucirumab as part of the treatment regimen.,"The study does not specifically describe the effect of Ramucirumab treatment, but rather focuses on resistance to anti-EGFR therapy and clonal evolution tracked via ctDNA."
36092332,Journal of gastrointestinal oncology,2022,Aug,,A post-marketing safety study of ramucirumab with FOLFIRI in patients with metastatic colorectal cancer.,Journal Article,"Toshiki Masuishi, Soshi Nagaoka, Long Jin, Kenichi Yoshizawa","Ramucirumab [human vascular endothelial growth factor (VEGF) receptor-2 monoclonal antibody] + levofolinate, fluorouracil, and irinotecan (FOLFIRI) was approved for the treatment of metastatic colorectal cancer (CRC) in Japan based on the results from the phase 3 RAISE trial (NCT01183780). However, safety information of ramucirumab + FOLFIRI in the real-world setting is limited. Therefore, the present study was conducted to evaluate the safety of ramucirumab + FOLFIRI under routine clinical practice in patients with metastatic CRC (mCRC) after first-line chemotherapy.
A single-arm, prospective, multicenter, non-interventional, observational study was conducted between August 2016 and May 2020. Patients with mCRC treated with ramucirumab + FOLFIRI for the first time were included. Patients were observed for 12 months from the start of ramucirumab. Data were recorded using the electronic data capture system.
In total, 362 patients with a mean age of 64.1 years were evaluated for safety, of whom 355 patients were evaluated for effectiveness. A higher proportion of the patients were males (n=200; 55.2%), had metastases and recurrent sites (n=362, 100.0%), and had received prior anti-cancer treatment (n=355; 98.1%). Approximately 83.7% (n=303) and 25.4% (n=92) of patients had medication history of bevacizumab and anti-epidermal growth factor receptor (EGFR) antibodies, respectively. Overall, 84.3% (n=305) of patients experienced any grade adverse events (AEs). Neutrophil count decreased (n=138; 38.1%), hypertension (n=58; 16.0%), and diarrhea (n=57; 15.7%) were observed frequently. The clinically relevant grade ≥3 AEs of special interest (AESIs) with >2% incidence included neutropenia (n=101; 27.9%), hypertension (n=35; 9.7%), proteinuria (n=23; 6.4%), hepatic dysfunction (n=15; 4.1%), febrile neutropenia (n=10; 2.8%), and leukopenia (n=9; 2.5%). The presence of renal disease at baseline increased the risk of proteinuria [risk ratio: 2.1; 95% confidence interval (CI): 1.1-4.2]. Three deaths were reported due to AEs, of which 1 was study treatment related. The 12-month survival rate of the ramucirumab + FOLFIRI regimen was 59%, mortality mainly (90%) occurring due to progressive disease.
Although the current observational study enrolled patients with various medication history, the regimen of ramucirumab + FOLFIRI was manageable under clinical practice. No new safety concerns beyond the findings observed in previous clinical trials were reported.",1,1,1,The study focuses on patients with metastatic colorectal cancer (mCRC).,The study examines the use of ramucirumab in combination with FOLFIRI as a treatment for mCRC.,"The study describes the effects of ramucirumab treatment, including adverse events and safety outcomes."
32244546,Cancers,2020,Mar,31,Safety of Aflibercept in Metastatic Colorectal Cancer: A Literature Review and Expert Perspective on Clinical and Real-World Data.,"Journal Article, Review","Kei Muro, Taylor Salinardi, Arvind Rup Singh, Teresa Macarulla","Metastatic colorectal cancer (mCRC) represents a substantial health burden globally and an increasing challenge in Asian countries. Treatment options include chemotherapy plus a vascular endothelial growth factor (VEGF) inhibitor (such as bevacizumab, aflibercept or ramucirumab), or anti-epidermal growth factor receptor (EGFR) therapies. Aflibercept, a recombinant fusion protein, has been approved for treatment of mCRC in combination with FOLFIRI for patients whose disease progresses during or after treatment with an oxaliplatin-containing regimen, based on its efficacy and tolerability profile in clinical trials. This report aims to provide an overview of both clinical and real-world evidence and experience on the use of aflibercept in routine clinical practice, with a focus on European, American and Asian populations.
A literature search was conducted in PubMed (on 28th February 2019) using the search terms (""aflibercept"") and (""Colorectal""OR""CRC"") to identify publications containing information on aflibercept-containing regimens.
The adverse events (AE) profile was similar between geographical locations. Across trials, real-world and retrospective studies, grade ≥ 3 hypertension and proteinuria were amongst the most frequently reported AEs.
The safety profile of aflibercept is generally manageable and comparable across various geographic locations.",1,-1,0,The paper focuses on patients with metastatic colorectal cancer (mCRC).,"The study examines aflibercept, not ramucirumab, as the VEGF inhibitor.",The paper describes the safety profile of aflibercept but does not specifically describe the effect of ramucirumab treatment.
39081965,Oncology letters,2024,Sep,,Ramucirumab in second‑line advanced colorectal cancer therapy: A study on therapeutic outcomes and hepatic sinusoidal platelet aggregation.,Journal Article,"Keisuke Kimura, Yosuke Katata, Yuzo Umeda, Takehiro Tanaka, Shuya Yano, Kazuhiro Yoshida, Toshiyoshi Fujiwara, Yoshiko Mori, Takeshi Yamada, Takeshi Nagasaka","The present study investigated the role of ramucirumab (RAM) in treating liver metastases (LMs) as a second-line or salvage treatment in patients with advanced CRC. Of the 36 patients, 21 (58%) received RAM plus folinic acid, fluorouracil and irinotecan (FOLFIRI) as second-line treatment, whereas 15 (42%) received it in a salvage setting. The median overall survival time was 23 months [95% confidence interval (CI), 12-34 months] for those in the second-line treatment group and 8 months (95% CI, 5-19 months) for those in the salvage treatment group. Of the 36 patients, 14 (39%) underwent surgical resection of LMs during chemotherapy. A total of 6 patients underwent surgical resection for LMs for the first time during second-line RAM plus FOLFIRI (RAM-LM); of the remaining 8 patients, 6 underwent resection of LMs during first-line bevacizumab (BEV)-based chemotherapy (BEV-LM). Immunohistochemical analysis of CD42b showed that the platelet aggregation score (CD42b score), which ranges from 0 (absence of deposition) to 3 (presence of linear deposition), tended to decrease with the increasing duration of treatment with both RAM and BEV. Although there was no significant difference in the mean duration of anti-VEGF antibody treatment between the BEV-LM and RAM-LM groups, the median CD42b score was higher in the RAM-LM group (median CD42b score, 3; range, 0-3) compared with that in the BEV-LM group (median CD42b score, 1; range, 0-3; P=0.01), suggesting that RAM induces a different degree of platelet aggregation in liver sinusoids compared to BEV.",1,1,1,The study explicitly mentions patients with advanced colorectal cancer (CRC) undergoing treatment with ramucirumab.,The study examines the use of ramucirumab in second-line and salvage treatment settings for advanced CRC.,"The study describes the effect of ramucirumab treatment, including its impact on overall survival and hepatic sinusoidal platelet aggregation."
37760533,Cancers,2023,Sep,14,Current Status of Angiogenesis Inhibitors as Second-Line Treatment for Unresectable Colorectal Cancer.,"Journal Article, Review","Satoshi Otsu, Shuichi Hironaka","Colorectal cancer is the third most common disease and the second most common cause of death around the world. The drug for second-line treatment depends on the drugs used in first-line treatment and the biomarker status. As biomarkers, the RAS gene, BRAF gene, and dMMR/MSI-H, TMB-H, and HER2 statuses have been established in clinical practice, and the corresponding molecularly targeted therapeutic agents are selected based on the biomarker status. Given the frequency of biomarkers, it is assumed that when patients move on to second-line treatment, an angiogenesis inhibitor is selected in many cases. For second-line treatment, three angiogenesis inhibitors, bevacizumab (BEV), ramucirumab (RAM), and aflibercept (AFL), are available, and one of them is combined with cytotoxic agents. These three angiogenesis inhibitors are known to inhibit angiogenesis through different mechanisms of action. Although no useful biomarkers have been established for the selection of angiogenesis inhibitors, previous biomarker studies have suggested that angiogenesis-related factors such as VEGF-A and VEGF-D might be predictors of the therapeutic efficacy of angiogenesis inhibitors. These biomarkers are measured as protein levels in plasma and are considered to be promising biomarkers. We consider that the rationale for selecting among these three angiogenesis inhibitors should be clarified to benefit patients.",1,1,0,The paper explicitly discusses patients with colorectal cancer.,The paper mentions ramucirumab as one of the angiogenesis inhibitors used in second-line treatment.,"The paper does not provide specific data or results on the effect of ramucirumab treatment, only general discussion on its use."
34298750,Cancers,2021,Jul,15,How May Ramucirumab Help Improve Treatment Outcome for Patients with Gastrointestinal Cancers?,"Journal Article, Review","Ming-Huang Chen, Sheng-Nan Lu, Chien-Hung Chen, Peng-Chan Lin, Jeng-Kai Jiang, Yulia D'yachkova, Mariusz Lukanowski, Rebecca Cheng, Li-Tzong Chen","GI cancers are characterized by high recurrence rates and a dismal prognosis and there is an urgent need for new therapeutic approaches. This is a narrative review designed to provide a summary of the efficacy as measured by overall survival, progression free survival, and safety data from phase 3 randomized controlled GI clinical trials of ramucirumab including those from important pre-specified patient subgroups and evidence from real clinical practice worldwide. Quality of life (QOL) is discussed where data are available. Our aim was to summarize the efficacy and safety of ramucirumab in the treatment of GI cancers using these existing published data with a view to demonstrating how ramucirumab may help improve treatment outcome for patients with GI cancers. The data indicate that ramucirumab is efficacious, safe, and tolerable across the intent-to-treat patient populations as a whole and across several pre-specified subgroups, even those whose disease is traditionally more difficult to treat. Furthermore, survival outcomes observed in real-world clinical practice demonstrate similar data from phase 3 clinical trials even in patients with complications, suggesting that the benefits of ramucirumab translate in actual clinical practice.",1,1,1,"The paper discusses patients with gastrointestinal cancers, which includes colorectal cancer.",The paper examines the use and efficacy of ramucirumab in the treatment of gastrointestinal cancers.,The paper describes the effect of ramucirumab treatment on survival outcomes and safety across various patient populations.
41880871,"European journal of cancer (Oxford, England : 1990)",2026,May,02,Randomized phase II study of FOLFIRI plus ramucirumab versus FOLFOXIRI plus ramucirumab as first-line treatment for metastatic colorectal cancer: WJOG9216G (RECAST).,"Journal Article, Clinical Trial, Phase II, Randomized Controlled Trial, Multicenter Study, Comparative Study","Yosuke Kito, Kentaro Yamazaki, Hirokazu Shoji, Takeshi Yamada, Takahiro Tsushima, Seiichiro Mitani, Kazuhiro Shiraishi, Hisateru Yasui, Hiroki Hara, Kenro Hirata, Taito Esaki, Yudai Shinohara, Takao Tsuzuki, Shinya Kajiura, Toshiki Masuishi, Naoki Izawa, Eishi Baba, Kohei Murata, Naoya Akazawa, Yozo Suzuki, Hironaga Satake, Narikazu Boku, Ichinosuke Hyodo, Kenichi Yoshimura, Hisato Kawakami, Shuichi Hironaka, Kei Muro","FOLFOXIRI plus bevacizumab improved efficacies and increased some adverse events in untreated metastatic colorectal cancer (mCRC), compared with the doublet plus bevacizumab. The clinical outcomes of ramucirumab (RAM) in combination with FOLFIRI or FOLFOXIRI as a first-line treatment are unknown. In this randomized phase II study (WJOG9216G), we compared the efficacy and safety of these regimens to determine which is more promising.
Patients with untreated mCRC were randomly assigned to the FOLFIRI-RAM or FOLFOXIRI-RAM arms. The primary endpoint was a confirmed objective response rate (ORR), and secondary endpoints included early tumor shrinkage (ETS), progression-free survival (PFS), overall survival (OS), and safety.
In total, 122 patients were randomized. The confirmed ORR was 59.3% and 60.3% in the FOLFIRI-RAM and FOLFOXIRI-RAM arms, respectively (odds ratio 1.04; P = 0.91). With a median follow-up period of 42.1 and 40.4 months, PFS was comparable between the FOLFIRI-RAM and FOLFOXIRI-RAM arms (median, 11.5 and 10.5 months). ETS rate (71.2% and 52.4%) and OS (median, 32.6 and 28.2 months) were significantly better in the FOLFIRI-RAM arm than in the FOLFOXIRI-RAM arm. The major grade ≥ 3 adverse events in the FOLFIRI-RAM and FOLFOXIRI-RAM arms were neutropenia (44.1% and 72.6%), anorexia (3.4% and 14.5%), and febrile neutropenia (3.4% and 11.3%).
FOLFOXIRI plus RAM was not superior to FOLFIRI plus RAM in terms of efficacy, including ORR, in patients with untreated mCRC. Instead, first-line FOLFIRI plus RAM showed clinical efficacy and safety profiles comparable to those of doublet chemotherapy plus bevacizumab.",1,1,1,The study focuses on patients with metastatic colorectal cancer (mCRC).,The study examines the use of Ramucirumab in combination with FOLFIRI or FOLFOXIRI as a first-line treatment.,"The study describes the effect of Ramucirumab treatment, including objective response rates, progression-free survival, overall survival, and safety profiles."
