PMID,Journal,Year,Month,Day,Title,Publication Type,Authors,Abstract,s1,s2,s3,r1,r2,r3
41489691,Clinical cancer research : an official journal of the American Association for Cancer Research,2026,Mar,02,Deep Learning-Derived Sarcopenia Marker Predicts Benefit from Anti-EGFR Therapy in Patients with RAS Wild-type Metastatic Colorectal Cancer.,"Journal Article, Randomized Controlled Trial","Julius Keyl, René Hosch, Fabian Hörst, Philipp Keyl, Amin Dada, Johannes Haubold, Jannis Straus, Jan Egger, Arndt Stahler, Annika Kurreck, Alexej Ballhausen, Sebastian Stintzing, Stefan Fruehauf, Lothar Müller, Annabel H S Alig, Tanja Trarbach, Sylvia Hartmann, Felix Nensa, Jens Kleesiek, Stefan Kasper, Martin Schuler, Dominik P Modest","The benefit of treatment intensification in metastatic colorectal cancer (mCRC) may be influenced by host-related factors that are not accounted for in clinical trials or standard care. We investigated the prognostic and predictive value of the muscle/bone ratio (MBR), a sarcopenia marker automatically derived from computed tomography (CT) images, in patients with mCRC from the prospective PanaMa study and a real-world validation cohort.
PanaMa (AIO KRK 0212; NCT01991873) randomized patients with RAS wild-type mCRC, following induction therapy, to maintenance therapy with fluorouracil and folinic acid (FU/FA) with or without panitumumab (Pmab). MBR was automatically calculated from baseline CT images using a validated deep learning model, and patients were stratified by MBR tertiles. Associations with progression-free survival (PFS) and overall survival (OS) were studied using Kaplan-Meier and Cox regression analyses. A retrospective real-world cohort of patients with mCRC treated with cetuximab was used for validation.
Premaintenance CT images were available for 189 of 248 randomized patients (76.2%) from PanaMa. In patients receiving FU/FA + Pmab, high MBR was associated with longer PFS [HR, 0.43; 95% confidence interval (CI), 0.25-0.73; P = 0.002] and OS (HR, 0.41; 95% CI, 0.21-0.77; P = 0.006), whereas no association was observed in patients receiving FU/FA alone. Pmab provided a PFS benefit only in patients with high MBR (HR, 0.42; 95% CI, 0.24-0.73; P = 0.002). The association of high MBR with superior PFS (P = 0.002) and OS (P < 0.001) was confirmed in the real-world cohort.
The benefit of anti-EGFR therapy in mCRC is confined to patients with a high MBR. Automated sarcopenia assessment holds promise for personalized treatment intensification in mCRC.",1,1,1,The study focuses on patients with metastatic colorectal cancer (mCRC).,The study examines the use and effect of cetuximab (as an anti-EGFR therapy) in a real-world validation cohort.,"The study describes the effect of cetuximab treatment, showing that its benefit is confined to patients with a high muscle/bone ratio (MBR)."
41476316,Experimental hematology & oncology,2025,Dec,31,Tetrahydromagnolol targets TRIM38 to mediate PANoptosis in cancer cells and has the potential for synergistic cancer therapy.,Journal Article,"Xiaoqing Gu, Lin Li, Ting Duan, Lijun Jin, Qinsong Sheng, Quan Gao, Mengting Chen, Xinbing Sui","Tetrahydromagnolol (THM) is a compound isolated from Magnolia officinalis with unique chemical structure and composition. However, its anticancer effect of THM and the underlying molecular mechanisms remain unclear.
Firstly, the anticancer effects of THM on different cancer cell lines in vitro were investigated. Subsequently, the antitumor activity of THM was further evaluated in vivo and in vitro using colorectal and lung cancer models. This assessment involved the effects of THM on cell viability, apoptosis, proliferation, cell cycle progression, and tumor growth inhibition. In addition, the anticancer molecular mechanisms of THM were determined by RNA sequencing, western blot, immunohistochemistry, immunofluorescence, CETSA, and SPR. Meanwhile, the effects of THM on organelles were evaluated by measuring endoplasmic reticulum stress, mitochondrial membrane potential damage, reactive oxygen species (ROS), and calcium ion concentration. Finally, the efficacy of THM in combination with conventional anticancer drugs for colorectal cancer treatment was evaluated in vivo.
The results showed that THM had a significant anticancer activity in colorectal cancer and lung cancer both in vitro and in vivo. THM significantly inhibited cell proliferation and induced PANoptosis-like cell death through GSDME mediated pyroptosis, CASP3 mediated apoptosis, and MLKL mediated necroptosis. In addition, the anticancer potential of THM was also related to elevation of endoplasmic reticulum stress, mitochondrial membrane potential destruction, and increase of ROS and intracellular calcium concentration. Mechanically, we found that THM could directly bind to triplet motif-containing 38 (TRIM38) and induced its upregulation at mRNA and protein levels. Importantly, knockdown of TRIM38 remarkably rescued the anticancer effects of THM and PANoptosis induced by THM treatment, suggesting that TRIM38 played a key role in mediating the antitumor activity of THM. In addition, THM showed significant synergistic therapeutic effects when used in combination with conventional anticancer strategies (Cetuximab, FOLFOX, and FOLFIRI regimens) for colorectal cancer treatment.
Our data suggest that THM exerts its anticancer potential by inducing TRIM38-dependent PANoptosis and it also has synergistic antitumor effects in combination with conventional anticancer strategies. THM will be a promising candidate drug used alone or in combination with other anticancer regimens for cancer treatment.",1,1,1,The study explicitly mentions colorectal cancer as one of the cancer models investigated both in vitro and in vivo.,The study examines the use of Cetuximab in combination with THM for colorectal cancer treatment.,"The study describes the synergistic effect of THM in combination with Cetuximab, indicating the effect of Cetuximab treatment."
40777125,Frontiers in oncology,2025,,,Case Report: A case of interstitial pneumonia in a colorectal cancer patient with a history of lung cancer treated with cetuximab.,"Case Reports, Journal Article","Yang Yang, Bin Zhang, Hongjun Li, Mei Ren, Daoqun Chong, Yujin Guo, Haibo Zhao, Qing-Qing Yu","This study aims to investigate the pathogenesis, clinical manifestations, and prognosis of interstitial lung disease (ILD) induced by cetuximab.
A single case of a colorectal cancer patient who underwent radical resection and descending colon-rectal anastomosis for sigmoid colon cancer on October 22, 2020, was selected. Postoperative pathology revealed moderately differentiated adenocarcinoma confined to the mucosa, measuring approximately 0.5×0.2×0.2 cm, with no cancer involvement in the proximal and distal resection margins, and metastatic carcinoma observed in 1 out of 5 pericolic lymph nodes. On July 29, 2021, due to a significant increase in CA19-9 levels, chest and abdominal CT scans, along with brain MRI, indicated enlarged retroperitoneal lymph nodes. The patient was afebrile and without respiratory symptoms such as cough, sputum production, chest tightness, or shortness of breath, and imaging suggested disease progression. With no significant abnormalities in C-reactive protein, blood routine, and no evidence of infection, cetuximab-related ILD was considered. Due to mild inflammation, the patient continued cetuximab combined with chemotherapy.
This study suggests that cetuximab can induce ILD, and the onset time may be associated with factors such as serum albumin levels and underlying pulmonary diseases.
The incidence of cetuximab-induced ILD is low and relatively rare, with non-specific clinical symptoms. Clinically, treatment plans should be tailored to the patient's actual condition to control disease progression and improve patient prognosis.",1,1,1,The study focuses on a patient with colorectal cancer.,The study examines the use of cetuximab in the treatment of a colorectal cancer patient.,"The study describes the effect of cetuximab treatment, specifically its association with interstitial lung disease (ILD)."
41930183,Cancer management and research,2026,,,Prognostic Impact of Cetuximab-Related Hypomagnesemia and Hypokalemia in RAS/RAF Wild-Type Colorectal Cancer: A Multicenter Study.,Journal Article,"Halil Göksel Güzel, Derya Kıvrak Salim, Ece Ulukal Karancı, Mehmet Acun, Mehmet Mutlu Çatlı, Ceren Mordağ Çiçek, Yagmur Karaman, Bahattin Engin Kaya, Aytaç Terzi, Çağlar Köseoğlu, Emir Gökhan Kahraman, Gamze Gököz Doğu, Ahmet Bilgehan Şahin, Melek Karakurt Eryılmaz, Elif Atağ, Seval Akay, Banu Öztürk","The prognostic value of cetuximab-related electrolyte disturbances in metastatic colorectal cancer (CRC) remains unclear. The available reports on the prognostic effect of hypomagnesemia are controversial, while there are no comprehensive analyses regarding hypokalemia. This study aimed to evaluate the impact of hypomagnesemia and hypokalemia on treatment outcomes in patients with RAS/RAF wild-type metastatic CRC receiving first-line cetuximab-based therapy.
We retrospectively analysed 305 patients treated across seven oncology centers between March 2013 and December 2024. Patients with baseline renal insufficiency or pre-existing electrolyte disturbance were excluded. Serum magnesium and potassium levels were assessed from the initiation of cetuximab until one month after its discontinuation.
There was one patient with missing magnesium levels and one patient with missing potassium levels. Three-hundred and four patients were available for the final analyses (n=304). Hypomagnesemia and hypokalemia occurred in 29.9% and 20.7% of the patients, respectively. Neither hypomagnesemia nor hypokalemia was significantly associated with progression-free survival (PFS) (11.9 vs 11.7 months for each; p=0.528 and p=0.327) or overall survival (OS) (25.3 vs 27.9 months; p=0.705 and 22.0 vs 28.8 months; p=0.824, respectively). Hypokalemia was correlated with a higher disease control rate (96.8% vs 87.1%, p= 0.028). In multivariate analyses, only metastatic burden (≥2 sites) independently associated with inferior outcomes for both PFS (HR 1.61, 95% CI 1.25-2.08, p< 0.001) and OS (HR 1.77, 95% CI 1.31-2.39, p< 0.001).
Hypomagnesemia and hypokalemia did not significantly impact survival outcomes despite previous studies indicating otherwise. Moreover, hypokalemia was linked to improved disease control. These results provide incremental evidence regarding the clinical relevance of electrolyte disturbances, particularly hypokalemia, and highlight the need for prospective studies to clarify their prognostic and predictive significance.",1,1,1,The study focuses on patients with metastatic colorectal cancer.,The study examines the use and effect of Cetuximab in the treatment of colorectal cancer.,"The study describes the effect of Cetuximab treatment, including the impact of related electrolyte disturbances on treatment outcomes."
41518467,Apoptosis : an international journal on programmed cell death,2026,Jan,10,Succinate-mediated SUCNR1 activation in tumor-associated macrophages promotes M2 polarization and cetuximab resistance in colorectal cancer: in vitro and in vivo insights.,Journal Article,"Shaofei Chen, Zhiyong Wang, Ping Sun, Yang Liu","Colorectal cancer (CRC) ranks among the most prevalent and lethal malignancies globally, with Cetuximab (CTx) resistance being a significant hurdle in its treatment. To uncover the underlying mechanisms, this study recruited 27 metastatic CRC patients undergoing CTx-based therapy and categorized them into responder and non-responder groups. In addition to measuring succinate levels in serum and tumor tissues and evaluating M2 macrophage infiltration in patients, a series of in vitro and in vivo experiments were conducted. In vitro, HT29 and Caco2 cells were treated with CTx and succinate under different conditions, including monoculture and co-culture with macrophages. The results indicated that succinate enhanced CRC cells' resistance to CTx specifically in the presence of macrophages by promoting M2 macrophage polarization. This effect was found to be mediated by succinate receptor 1 (SUCNR1), as demonstrated by experiments involving SUCNR1 knockdown. In vivo, the addition of succinate promoted tumor growth and weakened the inhibitory effect of CTx through macrophages. Further exploration revealed that succinate-induced polarized tumor-associated macrophages secreted IL-6, which played a crucial role in conferring CTx resistance. Overall, this study uncovers that tumor-secreted succinate confers CTx resistance in CRC by activating SUCNR1, thereby driving M2 macrophage polarization. These findings offer novel insights into the mechanisms of CRC resistance and identify potential therapeutic targets within the tumor microenvironment, which could potentially lead to the development of more effective treatment strategies for CRC patients.",1,1,1,The study explicitly focuses on patients with colorectal cancer (CRC) and uses CRC cell lines (HT29 and Caco2) in in vitro experiments.,"The study examines the use and effect of Cetuximab (CTx) in the context of CRC treatment, including its resistance mechanisms.","The study describes the effect of Cetuximab treatment, specifically its resistance in CRC cells mediated by succinate and M2 macrophage polarization."
40460045,Anti-cancer drugs,2025,Sep,01,"First-line treatment with a combination of immunotherapy, anti-EGFR monoclonal antibodies, and chemotherapeutics for unresectable left KRAS/BRAF wild-type microsatellite-stable colorectal cancer: a case report.","Journal Article, Case Reports","Yaoyi Zhang, Dongfeng Wang, Ke Zhang, Sheng Li, Chen Yu","Immunotherapy shows limited efficacy in microsatellite-stable (MSS) colorectal cancer. This case report describes a 40-year-old male with left-sided kirsten rat sarcoma viral oncogene homolog (KRAS)/v-raf murine sarcoma viral oncogene homolog B (BRAF) wild-type, MSS colorectal cancer and liver metastases who achieved complete regression of metastases following first-line treatment with toripalimab, cetuximab, and FOLFIRI (irinotecan + fluorouracil + leucovorin), enabling curative-intent surgical resection. The patient achieved a progression-free survival of 16 months and an overall survival exceeding 20 months. The regimen demonstrated excellent tolerability without severe adverse events, suggesting that this triple combination represents a promising strategy for conversion therapy in advanced MSS colorectal cancer.",1,1,1,The paper explicitly mentions patients with colorectal cancer.,The paper examines the use of Cetuximab as part of a combination treatment regimen.,The paper describes the effect of Cetuximab treatment in achieving complete regression of metastases and enabling curative-intent surgery.
41458789,Cureus,2025,Nov,,Pharmacist-Led Prevention of Recurrent Cetuximab Infusion Reactions.,"Case Reports, Journal Article","Yota Yamada, Arisa Fukuyama, Motoyasu Miyazaki, Yasutaka Sumi, Haruka Fukue, Akio Nakashima, Takayuki Akasaki, Osamu Imakyure","Cetuximab infusion reactions (IRs) can disrupt the continuity of effective treatment. However, there is a lack of standardized practical ward-level strategies to prevent IR recurrence. Herein, we report a single-case observation of a pharmacist-led approach combining H2-receptor antagonist premedication with infusion-time extension in a high-risk patient. A 69-year-old woman with metastatic colorectal cancer (RAS wild-type, microsatellite instability-high, BRAF V600E mutation) receiving encorafenib/binimetinib plus cetuximab developed Grade 2 IR during her first cetuximab infusion (approximately 98 min after initiation). She also exhibited hypoxemia and throat tightness. After discontinuing the infusion, she was treated with oxygen, d-chlorpheniramine, and famotidine, allowing completion at a reduced rate. For rechallenge, the interprofessional team implemented the following pharmacist-proposed optimization: routine H1 antihistamine plus 20 mg of intravenous famotidine and extension of cetuximab infusion to approximately 2 h, alongside standardized nursing surveillance. On the subsequent cycle, 465 mg of cetuximab (250 mg/m²) was administered without recurrence. No airway symptoms occurred. This pragmatic bundle targeted histamine-mediated pathways while tempering mediator release via the slower infusion, aligning with regulatory labeling that prioritizes H1 premedication and rate control yet enabling individualized risk mitigation after previous IRs. A pharmacist-driven checklist that adds H2 blockade and prolongs infusion may enhance safety and preserve treatment intensity in general ward settings where desensitization resources are limited. The generalizability of the findings is limited due to the single-patient design. Prospective validation comparing H1 alone versus combined H1 + H2 premedication, using predefined infusion-rate algorithms, is warranted.",1,1,1,"The paper describes a patient with metastatic colorectal cancer (RAS wild-type, microsatellite instability-high, BRAF V600E mutation) who received cetuximab.",The study examines the use of cetuximab in a patient with an infusion reaction and evaluates a pharmacist-led strategy to prevent recurrence.,"The study describes the effect of cetuximab treatment, including the occurrence of an infusion reaction and the successful rechallenge with optimized premedication and infusion rate."
41245504,Case reports in oncological medicine,2025,,,"Noninvasive Therapeutic Monitoring of Circulating Tumor DNA in BRAF-Mutant Metastatic Colon Cancer Using Droplet Digital PCR, Next-Generation Sequencing, and Fragmentomics.","Case Reports, Journal Article","Rachel C T Lam, Connie W C Hui, Irene O L Tse, Qing Zhou, Chit Chow, Wei Kang, K C Allen Chan, Brigette B Y Ma, W K Jacky Lam","BRAFV600E-mutated metastatic colorectal cancers (mCRCs) are associated with poorer prognosis. We present a case, in which noninvasive therapeutic monitoring was performed on a patient with BRAF-mutant mCRC, aiming to track disease progression and elucidate the mechanisms of response and resistance towards anti-BRAF therapy.
A 40-year-old man diagnosed with metastatic BRAFV600E mutant sigmoid adenocarcinoma received multiple lines of treatment, including first-line chemotherapy + bevacizumab and targeted therapy of cetuximab, encorafenib ± binimetinib. Noninvasive therapeutic monitoring was performed on ctDNA using our in-house designed droplet digital PCR assay and fragmentomics. We also performed serial and paired analyses of tissue, liquid biopsy, and in vitro studies at different multiple timepoints.
ctDNA and fragmentomics biomarkers were concordant with, and even preceded traditional serological and radiological biomarkers in predicting disease progression. Molecular analyses and drug testing also revealed mutations that are either potentially targetable or account for resistance, which guided the subsequent treatment regimen.
This case demonstrates the potential application of ctDNA and fragmentomics biomarkers, molecular analyses, and drug testing in noninvasive therapeutic monitoring of BRAFV600E mutant mCRC. These illustrate the potential application of such noninvasive therapeutic monitoring in larger scale cohorts of patients.",1,1,1,The study focuses on patients with metastatic BRAFV600E mutant colorectal cancer.,"The study examines the use of cetuximab as part of the treatment regimen, including in combination with other therapies.","The study describes the effect of cetuximab treatment, including its role in the patient's treatment and the identification of resistance mechanisms."
41775173,Cancer treatment and research communications,2026,Feb,24,"Conversion treatment with hepatic arterial infusion of oxaliplatin, leucovorin and fluorouracil plus intravenous bevacizumab or cetuximab for initially unresectable colorectal liver metastasis: A prospective study.",Journal Article,"Wei Liao, Qi Cheng, Lin Chen, Binhao Zhang, Zeyang Ding, Ketao Mu, Anhui Xu, Jia Song, Wei Dong, Mingsheng Zhang, Jin Chen, Zhao Huang, Xiaoping Chen, Peng Zhu, Bixiang Zhang","To evaluate the conversion to resection rate (CTRR), treatment safety and short-term oncological outcomes of FOLFOX-hepatic arterial infusion chemotherapy (FOLFOX-HAIC) plus intravenous bevacizumab or cetuximab for initially unresectable colorectal liver metastasis (IU-CRLM).
Data from a consecutive cohort of IU-CRLM patients who underwent conversion treatment using FOLFOX-HAIC with bevacizumab or cetuximab in Tongji Hospital were reviewed. The CTRR, tumor response, safety of drug treatment and surgery, potential predictive factors, and short-term oncological outcomes were got to preliminarily evaluate this conversion regimen.
A consecutive cohort of 42 patients were screened, and finally, 19 patients were enrolled in the study. 13 patients successfully underwent liver resection, the CTRR was 68.4%. Patients in no resection group showed more ratio of prior chemotherapy and prior resection of primary tumor, reduced chemotherapy dose, worse tumor differentiation and more lymphvascular invasion than in resection group. Patients in resection group showed better tumor response, including overall response, objective response, largest tumor diameter and levels of tumor biomarkers after treatment, except for disease control rate, than in no resection group. The incidence of grade≥3 adverse event was 21.1% and no pharmacotherapy-related death occurred in HAIC. The median operative time was 265 min and no grade≥2 intraoperative incidents occurred. The incidence of postoperative complications was 23.1%, but serious complication rate was only 7.7% and no death occurred with 90 days after surgery.
FOLFOX-HAIC was an effective and safe conversion treatment for IUCRLM without extrahepatic metastasis.",1,1,1,"The study focuses on patients with colorectal liver metastasis, which is a form of colorectal cancer.",The study examines the use of cetuximab as part of the conversion treatment regimen alongside FOLFOX-HAIC.,"The study describes the effect of cetuximab treatment by comparing outcomes between patients who underwent resection and those who did not, including tumor response and safety data."
