PMID,Journal,Year,Month,Day,Title,Publication Type,Authors,Abstract,s1,s2,s3,r1,r2,r3
40949402,World journal of gastrointestinal surgery,2025,Aug,27,Clinical observation of combined transarterial chemoembolization and targeted therapy in postoperative recurrent colorectal cancer with liver metastasis.,Journal Article,"Jian-Yu Liu, Zhi-Hui Liang, Jing-Lei Liu, Liang Li, Bao Cui, Tie-Gang Li","Colorectal cancer (CRC) with liver metastasis remains a significant therapeutic challenge, particularly in cases of postoperative recurrence. While transarterial chemoembolization (TACE) and targeted therapies have shown promise individually, the efficacy combining these for treating postoperative recurrent CRC with liver metastasis requires further investigation.
To evaluate the efficacy and safety of TACE combined with targeted therapies for postoperative recurrent CRC with liver metastasis.
This observational study enrolled 75 patients with postoperative recurrent CRC accompanied by liver metastasis between January 2020 and December 2023. All patients received combined treatment with TACE and targeted therapy: Bevacizumab (40 patients, 53.3%), cetuximab (25 patients, 33.3%), or panitumumab (10 patients, 13.3%). Treatment response was evaluated using the Response Evaluation Criteria in Solid Tumors 1.1 criteria, with overall survival (OS) and progression-free survival as the primary endpoints. Quality of life was assessed using the European Organization for Research and Treatment of Cancer quality of life questionnaire at baseline and after six months of treatment.
The median OS was 28 months (95% confidence interval: 24-32 months), and the median progression-free survival was 12 months (95% confidence interval: 10-14 months). Patients treated with bevacizumab showed significantly better survival outcomes than those treated with cetuximab/panitumumab (median OS, 30 vs 24 months, P = 0.015). The overall response rate was 58.7%, with a disease control rate of 86.7%. Quality of life scores improved significantly across all domains, with greater improvements observed in the bevacizumab group. Treatment-related adverse events were manageable, with grade 3-4 events occurring in 13.3% of the patients and no treatment-related mortality.
The combination of TACE with targeted therapy, particularly bevacizumab, has demonstrated promising efficacy and acceptable safety for the treatment of postoperative recurrent CRC with liver metastasis. This multimodal approach not only improved survival outcomes but also enhanced the patients' quality of life, suggesting its potential as a valuable treatment strategy for this challenging condition.",1,1,1,The study focuses on patients with postoperative recurrent colorectal cancer with liver metastasis.,The study examines the use of cetuximab as one of the targeted therapies combined with TACE.,"The study describes the effect of cetuximab treatment, including survival outcomes and response rates."
41230651,"Future oncology (London, England)",2025,Dec,,BREAKWATER Phase III: results for encorafenib and cetuximab plus mFOLFOX6 in first-line,"Journal Article, Clinical Trial, Phase III","Scott Kopetz, Josep Tabernero, Elena Élez","The BREAKWATER Phase III study investigated encorafenib and cetuximab plus mFOLFOX6 versus chemotherapy with or without bevacizumab for the treatment of patients with previously untreated BRAF V600E - mutant metastatic colorectal cancer. The study showed significantly improved objective response rate by blinded independent central review, and significantly longer progression-free survival by blinded independent central review and overall survival in patients treated with first-line encorafenib and cetuximab plus mFOLFOX6 compared with chemotherapy with or without bevacizumab. The safety profiles were consistent with those known for each agent. These results led to the approval of encorafenib and cetuximab plus mFOLFOX6 for the treatment of BRAF V600E-mutant metastatic colorectal cancer, including in the first line. This paradigm shift in metastatic colorectal cancer highlights the importance for early genomic testing to identify patients who would benefit from this new treatment option. We discuss the results from BREAKWATER - including progression-free survival by blinded independent central review, overall survival, objective response rate by blinded independent central review in all participants, and safety - and the meaning of these results for clinical practice as a new treatment option and the need for earlier genomic testing.Clinical Trial Registration: www.clinicaltrials.gov identifier is NCT04607421.",1,1,1,The study focuses on patients with BRAF V600E-mutant metastatic colorectal cancer.,The study examines the use of Cetuximab in combination with encorafenib and mFOLFOX6 as a treatment.,"The study describes the effect of Cetuximab treatment, including improved objective response rate, progression-free survival, and overall survival."
40971540,Cancer biomarkers : section A of Disease markers,2025,Sep,,Unraveling the role of PREX2 mutations as a biomarker for immunotherapy response in colorectal cancer.,Journal Article,"Huan Peng, Pengmin Yang, Xintao Wang, Xiaokai Zhao, Jieyi Li, Ziying Gong, Daoyun Zhang, Zhiguo Wang","IntroductionImmunotherapy benefits gastrointestinal tumor patients. But traditional biomarkers like TMB and MSI can't precisely identify beneficiaries. Phosphatidylinositol - 3,4,5 - triphosphate - dependent Rac exchange factor 2 (PREX2) plays a complex role in tumorigenesis.MethodsIn a retrospective study of 1764 patients (1385 colorectal, 379 gastric), NGS of 639 genes and PD - L1 staining were done.ResultsIn colorectal cancer, PREX2 mutations were associated with increased TMB, MSI, TMB-H, and MSI-H. Mechanistically, this is related to an increased number of tumor pathway mutations, higher PD - L1 expression, increased immune infiltration, and immune - related pathway enrichment. Cetuximab and Bortezomib sensitivity was higher in PREX2 - mutated colorectal cancer. In gastric cancer, there are no established immune associations with PREX2 mutations.ConclusionPREX2 mutations may serve as a novel predictive biomarker for immunotherapy in CRC, potentially enhancing antitumor immunity via microenvironment modulation, but lack predictive value in GC. These findings highlight PREX2's role in refining patient stratification for immune checkpoint inhibitors.",1,1,1,The study focuses on patients with colorectal cancer.,The study examines the sensitivity of Cetuximab in colorectal cancer patients with PREX2 mutations.,The study describes the increased sensitivity of Cetuximab in PREX2-mutated colorectal cancer.
41603178,Current pharmaceutical biotechnology,2026,Jan,26,Biological Therapies for Metastatic Colorectal Cancer: Literature Review.,Journal Article,"Maria Patricia Pereira Almeida, Mónica Sofia Leal Condinho","Colorectal cancer is among the most prevalent and lethal malignancies worldwide. Its initially asymptomatic nature contributes to a high incidence of metastatic cases. Although predominantly diagnosed in older adults, the incidence among younger populations is rising at an alarming rate. Historically, treatment has relied on antineoplastic agents such as 5-fluorouracil, irinotecan, and oxaliplatin. While these agents remain in use, their effectiveness is limited, particularly in metastatic disease, with modest improvements in overall survival and progressionfree survival. Moreover, their low target specificity results in significant systemic toxicity. This underscores the urgent need formore selective and less toxic therapeutic strategies, such as monoclonal antibodies. Monoclonal antibodies targeting Vascular Endothelial Growth Factor (VEGF), Epidermal Growth Factor Receptor (EGFR), and immune checkpoints have become integral to the management of metastatic colorectal cancer. Notable examples include bevacizumab (anti-VEGF), cetuximab and panitumumab (anti-EGFR), and the immune checkpoint inhibitors pembrolizumab, nivolumab, and ipilimumab. Their clinical success especially when guided by molecular tumour profiling highlights their contribution to improved patient outcomes. In addition, other targeted therapies distinct from monoclonal antibodies are currently under investigation.",1,1,0,The paper discusses colorectal cancer as the primary focus.,The paper mentions Cetuximab as one of the monoclonal antibodies used in the treatment of metastatic colorectal cancer.,"The paper does not provide specific details on the effect of Cetuximab treatment, only general mentions of its use."
40637536,Recenti progressi in medicina,2025,,,[Clinical experience with encorafenib and cetuximab in patients with BRAFV600E-mutant metastatic colorectal cancer after early relapse following adjuvant chemotherapy].,"Journal Article, Case Reports, English Abstract","Vincenzo Formica, Marco Maria Germani, Giulia Piacentini, Elena Traverso, Chiara Cremolini","Metastatic colorectal cancer (mCRC) is constituted of several biological subgroups characterized by molecular alterations activating specific proliferative pathways. These alterations have, for a long time, lacked targeted therapies capable of inactivating these signalling pathways and eventually modifying the course of the disease. This scenario has rapidly been evolving in recent years, thanks to a better understanding of mCRC biology and advances in drug development, that have turned these alternations into ""actionable"" targets. BRAFV600E is a landmark example of this process. Conceived for roughly a decade as a negative prognostic factor of outcome and as a predictor of resistance to anti-EGFRs, today it is also a predictor of response to the combination of the anti-BRAF encorafenib and of the anti-EGFR cetuximab, and a standard of care in patients with BRAFV600E-mutated mCRC, after failure of previous systemic therapy. In this work, we report three clinical scenarios where encorafenib and cetuximab are used in label as first-line of treatment, at the diagnosis of mCRC, after early relapse occurring at the end of adjuvant chemotherapy.",1,1,1,The paper explicitly discusses patients with metastatic colorectal cancer (mCRC).,The paper examines the use of cetuximab in combination with encorafenib as a treatment for BRAFV600E-mutant mCRC.,The paper describes the clinical use of cetuximab in specific treatment scenarios for patients with BRAFV600E-mutant mCRC.
41332047,International journal of surgery case reports,2025,Nov,,Case report of sigmoid colon cancer with synchronous peritoneal metastasis achieving a pathological complete response after mFOLFOX6 plus cetuximab.,"Case Reports, Journal Article","Kohei Takehara, Hiroaki Kasashima, Tatsunari Fukuoka, Yuki Seki, Masatsune Shibutani, Kiyoshi Maeda","Synchronous peritoneal metastasis occurs in about 5 % of colorectal cancer (CRC) cases, often with other distant metastases. Due to poor drug penetration, chemotherapy is typically ineffective, leading to poor prognosis. Here, we report a rare case of sigmoid colon cancer with synchronous peritoneal metastasis achieving pathological complete response (pCR) after systemic chemotherapy.
A 74-year-old man was diagnosed with acute generalized peritonitis from a perforated sigmoid colon cancer with two peritoneal metastases. One peritoneal lesion was left unresected, and sigmoid colectomy with partial jejunal resection was performed. Additionally, postoperative colonoscopy revealed a synchronous cancer in the cecum. Chemotherapy with mFOLFOX6 plus cetuximab was initiated. After 10 cycles, the patient developed strangulation ileus, requiring surgery, during which a peritoneal nodule was resected and showed no viable cancer cells, indicating pCR. Chemotherapy was resumed and completed to 12 cycles. Laparoscopic ileocecal resection for the cecal cancer also achieved pCR. A single peritoneal recurrence was surgically removed. No recurrence has been observed for 7 months.
Reports of pCR with peritoneal metastases are extremely rare. Although the mechanism of the remarkable response in this case remains unclear, given the rarity of pCR in CRC with peritoneal metastasis, further case accumulation and analysis are warranted.
This is a rare case of pCR to systemic chemotherapy for CRC with synchronous peritoneal metastasis.",1,1,1,"The paper focuses on a patient with sigmoid colon cancer, which is a type of colorectal cancer.",The study examines the use of Cetuximab in combination with mFOLFOX6 as part of the treatment regimen.,"The paper describes the effect of Cetuximab treatment, noting that the patient achieved a pathological complete response after 10 cycles of chemotherapy."
41107466,Communications medicine,2025,Oct,17,Discovering anticancer drug target combinations via network-informed signaling-based approach.,Journal Article,"Bengi Ruken Yavuz, Hyunbum Jang, Ruth Nussinov","Oncologists deciding on cancer treatments must make difficult decisions as to which prescription and implementation strategies would best suit each patient. Much is still unknown about combinations of prescription drugs as there are many to choose from. At the outset, the oncologist reckons with at least two established facts: (i) patients receiving successive single molecules treatments are likely to experience drug resistance, and (ii), to select optimal drug combinations requires to pick the 'best' protein drug target combinations. Intuitively, target selection should precede drug selection, implying that well-informed strategies would opt to first consider drug targets - not drugs - combinations. Nowadays, drug combinations that oncologists consider are empirical and limited. They are restricted primarily by observations and praxis, that is, scant clinical experience with their application.
Here we develop a strategy for selecting optimal drug target combinations following nature. We use protein-protein interaction networks and shortest paths to discover communication pathways in cells based on interaction network topology. Our strategy mimics cancer signaling in drug resistance, which commonly harnesses pathways parallel to those blocked by drugs, thereby bypassing them.
We select key communication nodes as combination drug targets inferred from topological features of networks. We test our network-informed signaling-based approach to discover anticancer drug target combinations on available clinical data, patient-derived breast and colorectal cancers. Alpelisib + LJM716 and alpelisib + cetuximab + encorafenib combinations diminish tumors in breast and colorectal cancers, respectively.
Our network-based approach discovers optimal protein co-target combinations to counter resistance, selecting co-targets from alternative pathways and their connectors.",1,1,1,The paper mentions patient-derived colorectal cancers as one of the models tested.,The paper explicitly mentions the use of cetuximab in combination with other drugs for treating colorectal cancer.,The paper describes the effect of cetuximab as part of a combination therapy that diminishes tumors in colorectal cancer.
41161250,Translational oncology,2026,Jan,,Expression of Bacillus in colorectal tissues is associated with improved cetuximab therapy for patients with metastatic colorectal cancer.,Journal Article,"Hung-Chih Hsu, Hsin-Yu Chung, Jeng-Fu You, Yun-Shien Lee, Jeng-Shou Chang, Hsin-Han Hou, Chuang-Wei Wang","Metastatic colorectal cancer (mCRC) remains the second leading cause of cancer-related deaths worldwide. Previous studies have shown that somatic mutations and gut microbiota contribute to mCRC progression. However, whether microbiota profiles in colorectal tissues are related to mCRC prognosis and correlate with patients' somatic mutations remains unclear.
We aimed to characterize microbiota expression profiles in formalin-fixed paraffin-embedded (FFPE) colorectal cancer tissues of patients with mCRC to analyze their prognostic role.
FFPE cancer tissues from 65 patients with mCRC were divided into two groups based on overall survival (OS > 4years, OS < 4 years). These groups were analyzed for microbiota expression profiles, somatic mutations, and treatment outcomes.
Higher relative expression of Bacillus and Coprococcus in metastatic colorectal tumor tissues were associated with longer overall survival (hazard ratio [HR] = 0.5; p = 0.008 and 0.013, respectively), while higher Streptococcus expression had a shorter overall survival (HR = 2.0; p = 0.011). Patients with PTPRT/D and without KMT2D mutations had higher Bacillus expression in colorectal tumor tissues (all p < 0.05). Importantly, patients with higher Bacillus expression who received cetuximab (an epidermal growth factor receptor [EGFR] inhibitor) therapy had longer overall survival (median 34.1 months vs 19.4 months; HR = 0.5; p = 0.029) and progression-free survival (median 12.6 months vs 6.2 months; HR = 0.5, p = 0.0019) compared with those with lower relative expression.
Our study suggests that Bacillus expression in colorectal tissues is associated with improved outcomes in patients with mCRC receiving cetuximab therapy.",1,1,1,The study focuses on patients with metastatic colorectal cancer (mCRC).,The study examines the effect of Cetuximab therapy in patients with mCRC.,"The study describes the effect of Cetuximab treatment, showing improved survival outcomes in patients with higher Bacillus expression."
41094393,Biological procedures online,2025,Oct,15,Rap2B-mediated reprogramming of the PI3K/AKT signaling axis drives resistance to cetuximab-targeted therapy in colorectal carcinoma.,Journal Article,"Shanshan Zhang, Ying Wei, Tingting Liu, Chenhao Sun, Xiuzhen Ge, Yang Ni, Xiaonan Tang, Mridul Roy, Tingmin Chang, Xiaohong Kang","Targeted therapy resistance represents a significant clinical challenge in cancer treatment. Rap2B, a member of the Ras superfamily of small GTPases, is frequently overexpressed in various cancers and has been implicated in promoting tumor progression and therapy resistance. However, the role and underlying mechanisms of Rap2B in cetuximab resistance in colorectal cancer (CRC) remain to be elucidated. This study aims to investigate Rap2B expression patterns in CRC models and explore the mechanisms by which Rap2B mediates cetuximab resistance.
The expression level of Rap2B in CRC cell lines exhibits a significant negative correlation with sensitivity to cetuximab. In vivo experiments demonstrated that Rap2B downregulation significantly reduced tumor growth and enhanced cetuximab efficacy. Knockdown of Rap2B increases cetuximab sensitivity by inhibiting the PI3K/AKT signaling pathway, resulting in reduced cell proliferation and enhanced apoptosis. Conversely, overexpression of Rap2B induces cetuximab resistance by activating the PI3K/AKT pathway.
This study highlights a close association between Rap2B overexpression and cetuximab resistance in CRC. The enhanced expression of Rap2B plays a pivotal role in conferring resistance, by activating the PI3K/AKT signaling pathway. Targeting Rap2B or its downstream pathways has the potential to provide novel therapeutic strategies for overcoming cetuximab resistance in colorectal cancer.
The online version contains supplementary material available at 10.1186/s12575-025-00303-3.",1,1,1,The study focuses on colorectal cancer (CRC) cell lines and in vivo CRC models.,"The study examines the effect of Cetuximab on CRC models, specifically its sensitivity and resistance.","The study describes the effect of Cetuximab treatment, including its efficacy and resistance mechanisms mediated by Rap2B."
41319450,"European journal of cancer (Oxford, England : 1990)",2026,Jan,,Impact of sex on efficacy and safety of 1st-line treatment with FOLFIRI plus cetuximab or bevacizumab in RAS/BRAF wildtype metastatic colorectal cancer - A subgroup analysis of the FIRE-3 (AIO KRK-0306) trial.,"Journal Article, Randomized Controlled Trial, Clinical Trial, Phase III, Multicenter Study","Kathrin Heinrich, Sebastian Stintzing, Ludwig Fischer von Weikersthal, Thomas Decker, Alexander Kiani, Florian Kaiser, Salah-Eddin Al-Batran, Tobias Heintges, Christoph Lerchenmüller, Christoph Kahl, Gernot Seipelt, Frank Kullmann, Markus Moehler, Werner Scheithauer, Andreas Jung, Julian W Holch, Swantje Held, Dominik Paul Modest, Volker Heinemann","Clinical trials in metastatic colorectal cancer (mCRC) are usually conducted irrespectively of sex. However, differences relating to safety and efficacy in the treatment of mCRC between male and female patients are of growing interest.
The randomized FIRE-3 study compared first-line treatment with folinic acid, 5-fluorouracil and irinotecan (FOLFIRI) plus cetuximab to FOLFIRI plus bevacizumab in patients with RAS wildtype (RAS WT) mCRC. The present analysis focusses on the impact of sex and primary tumor (PT) sidedness on outcome parameters.
Of 352 patients with RAS WT tumors, 249 (71 %) were male and 103 (29 %) female. In male patients with left-sided RAS/BRAF WT tumors, a significant benefit from cetuximab was noted with regard to ORR (OR 1.15; P = 0.035) and OS (0.66; P = 0.010), while in right-sided patients cetuximab improved ORR (OR 2.92) and had no significant effect on PFS or OS. In female patients with left-sided, RAS/BRAF WT PT, a comparable effect of cetuximab versus bevacizumab was observed with regard to ORR (OR 1.05; P > 0.999), while a numerical OS benefit was noted in the cetuximab-arm (HR 0.78; P = 0.385). By contrast, in female patients with right-sided PT, a clearly detrimental effect of cetuximab-based therapy was observed for ORR (OR 0.44; P = 0.617), PFS (HR 4.95; P = 0.005), and OS (HR 2.58; P = 0.080). In the bevacizumab arm, neutropenia grade ≥ 3 was more frequent in female versus male patients (30.6 % versus 18.3 %; P = 0.063). Otherwise, there was no significant difference of grade ≥ 3 adverse events between male and female patients.
The exploratory analysis of FIRE-3 suggests that the efficacy of cetuximab combined with FOLFIRI in RAS wild-type mCRC is related to sex and primary tumor sidedness. The results support the inclusion of patient sex into the design of future trials.",1,1,1,The study focuses on patients with metastatic colorectal cancer (mCRC).,The study examines the use and effect of Cetuximab as part of first-line treatment (FOLFIRI plus Cetuximab) compared to Bevacizumab.,"The study describes the effect of Cetuximab treatment on outcomes such as ORR, PFS, and OS, with differences observed based on sex and tumor sidedness."
40562041,Cell reports. Medicine,2025,Jul,15,"Impact of the tumor immune contexture in microsatellite-stable metastatic colorectal cancer treated with avelumab, cetuximab, and irinotecan.","Journal Article, Clinical Trial, Phase II","Nicolas Huyghe, Elena Benidovskaya, Tariq Masoodi, Isabelle Sinapi, Astrid De Cuyper, Fazulur Vempalli, Simon Beyaert, Caroline Bouzin, Finoula Maestre Osorio, Luigi Ferraro, Nicolas van Baren, Raphaël Helaers, Pierre Goffette, Benoit Ghaye, Aline van Maanen, Marie-Laure Castella, Michele Ceccarelli, Davide Bedognetti, Jérôme Galon, Wouter R L Hendrickx, Javier Carrasco, Marc Van den Eynde","The treatment of patients with microsatellite-stable (MSS) metastatic colorectal cancer (mCRC) remains a significant clinical challenge. Cetuximab, an anti-epidermal growth factor receptor (EGFR) monoclonal antibody (mAb), induces immunogenic cell death, potentially synergizing with immune checkpoint inhibitors. The phase 2, proof-of-concept, single-arm AVETUXIRI trial (ClinicalTrials.gov: NCT03608046) evaluates the safety and efficacy of cetuximab, irinotecan (a topoisomerase I inhibitor), and avelumab (an anti-programmed cell death ligand 1 [PD-L1]) in 57 patients with RAS wild-type or mutated MSS mCRC refractory to chemotherapy and anti-EGFR mAbs. Exploratory objectives include investigating the tumor immune microenvironment within mCRC biopsies performed during the trial and correlating it with treatment activity. A manageable safety profile is observed. Although the overall efficacy endpoints are not met, biomarkers associated with clinical efficacy are identified. Patients exhibiting a high Immunoscore, strong cytotoxic and T cell proximity to tumor cells, and a high genetic immunoediting score within mCRC biopsies before treatment demonstrate significant therapeutic survival benefit, independent of RAS tumor mutation status.",1,1,1,The study focuses on patients with metastatic colorectal cancer (mCRC).,The study examines the use of cetuximab as part of a combination treatment regimen.,"The study describes the effect of cetuximab treatment, including its potential immunogenic cell death and correlation with survival benefit based on immune biomarkers."
41238504,Clinical colorectal cancer,2026,Mar,,Therapy-Induced Metastatic Melanoma During Treatment With Encorafenib and Cetuximab for BRAF-Mutated Colorectal Cancer: A Case Report and Short Literature Review.,"Case Reports, Journal Article","Nerina Denaro, Renato M Marsicano, Barbara Galassi, Sveva Mortellaro, Giulia Murgia, Emanuela Passoni, Ornella Garrone, Michele Ghidini",,1,1,1,"The paper discusses a patient with BRAF-mutated colorectal cancer, confirming the focus on colorectal cancer.",The paper examines the use of Cetuximab in combination with Encorafenib as part of the treatment for BRAF-mutated colorectal cancer.,"The paper describes the effect of Cetuximab treatment, specifically in the context of therapy-induced metastatic melanoma."
