PMID,Journal,Year,Month,Day,Title,Publication Type,Authors,Abstract,s1,s2,s3,r1,r2,r3
41876642,Scientific reports,2026,Mar,24,A predictive model for treatment efficacy in RAS wild-type advanced colorectal cancer: development and external validation for EGFR inhibitor plus anti-angiogenic therapy based on a retrospective cohort.,Journal Article,"Yanhong Jin, Lifang Gong, Siyu Tang","Efficacy of EGFR inhibitor-anti-angiogenic combination therapy varies substantially in RAS wild-type advanced colorectal cancer (CRC), and current clinical guidelines lack individualized predictive tools to identify optimal candidates and tailor regimens. This study aimed to develop and externally validate a multi-dimensional efficacy prediction model to address this unmet clinical need. This retrospective multi-center study included 600 RAS wild-type advanced CRC patients (development cohort: 420 patients from two centers; external validation cohort: 180 patients from an independent center) treated with EGFR inhibitors (cetuximab/panitumumab) plus anti-angiogenic agents (bevacizumab/fruquintinib/regorafenib) between 2018 and 2021. Candidate variables encompassed clinical, laboratory, radiomic, and biological indices. Radiomic features were screened via ANOVA-dimensionality reduction, and LASSO-Cox regression was used for variable selection and nomogram construction (with shrinkage calibration to reduce overfitting). Model performance was evaluated by discrimination (AUC), calibration (Hosmer-Lemeshow test), and clinical utility (decision curve analysis [DCA]); the overfitting risk was assessed by calculating events per variable (EPV), and model stability was verified by multi-step internal validation (tenfold cross-validation, bootstrap resampling) and subgroup/risk stratification analyses. The final nomogram integrated five core predictors: vascular density, neutrophil-to-lymphocyte ratio (NLR), carcinoembryonic antigen (CEA), metastatic sites, and ECOG score. The model exhibited moderate discrimination with clinical practical value (development cohort AUC = 0.641, 95%CI 0.588-0.691; validation cohort AUC = 0.532, 95%CI 0.445-0.617), which is consistent with the performance of most multi-dimensional clinical prediction models for advanced colorectal cancer reported in similar studies (AUC range 0.58-0.68). Meanwhile, the model showed excellent calibration in the external validation set (H-L χ2 = 1.12, p = 0.572), indicating a high consistency between the predicted PFS probability and the actual clinical outcome. The limited discrimination of the model is mainly due to the inherent biological heterogeneity of advanced colorectal cancer and the lack of dynamic monitoring indicators (e.g., circulating tumor DNA) in the study variables. Risk stratification identified low (0.7%), intermediate (57.3%), and high-risk (42.0%) groups with significantly distinct progression-free survival (PFS) and overall survival (OS) (all log-rank p < 0.001). High-risk patients who switched regimens achieved longer median PFS (11.1 vs. 5.9 months, p < 0.001). DCA confirmed superior net benefit over ""treat all/none"" strategies, and the model outperformed guidelines (median PFS: 9.3 months [both recommended] vs. 6.7 months [guideline-only], p < 0.05). Key biomarkers (vascular density, tumor mutational burden) correlated with treatment response and risk stratification, providing biological rationale. This externally validated nomogram integrating five readily available clinical and laboratory indicators can realize individualized PFS prediction and risk stratification for RAS wild-type advanced CRC patients receiving EGFR inhibitor-anti-angiogenic combination therapy, and provide preliminary reference for clinical regimen adjustment of high-risk patients. As a supplementary tool to current clinical guidelines, the model can partially address the problem of clinical response heterogeneity in combination therapy and provide simple decision support for clinicians in primary and secondary hospitals with limited detection conditions. However, the model has certain limitations in long-term prognostic prediction and needs to be further optimized and validated in larger, multi-center prospective cohorts before it can be translated into clinical practice of precision oncology.",1,1,1,The study focuses on patients with RAS wild-type advanced colorectal cancer.,The study examines the use of Cetuximab as part of EGFR inhibitor-anti-angiogenic combination therapy.,"The study describes the effect of Cetuximab treatment in combination with anti-angiogenic agents, including its efficacy and variability in treatment response."
40761192,AME case reports,2025,,,Perforated primary adenocarcinoma of the colon with choriocarcinoma differentiation treated with targeted colorectal cancer chemotherapy: a case report.,"Case Reports, Journal Article","Naoki Ishimaru, Takashi Tagami, Misako Yamasaki, Kazuya Niwa","Colorectal choriocarcinoma is a rare condition with a poor prognosis, and no standard chemotherapy regimen has been established. A combination of cetuximab, encorafenib, and binimetinib as adjuvant chemotherapy may be effective for colorectal choriocarcinoma. This treatment approach has not been previously reported for this rare malignancy.
We describe the case of a 59-year-old woman who underwent right hemicolectomy for a transverse colon perforation and was diagnosed with primary colorectal adenocarcinoma with choriocarcinoma differentiation. Adjuvant chemotherapy with folinic acid, fluorouracil, and oxaliplatin (FOLFOX) and bevacizumab was administered for colorectal adenocarcinoma, but disease progression was observed. The patient had a BRAF V600E mutation, tested negative for human chorionic gonadotropin (hCG), and was switched to a combination of encorafenib, cetuximab, and binimetinib. The treatment response was monitored through regular imaging studies and tumor marker measurements. The patient has been alive for 34 months with no metastases or recurrence, and with continued reduction in the size of the lymph nodes and peritoneal lesions.
Standard chemotherapy for the treatment of choriocarcinoma and colorectal adenocarcinoma has been applied to colorectal choriocarcinoma. In patients with a BRAF V600E mutation and decreased hCG levels, a combination of encorafenib, cetuximab, and binimetinib may be a useful chemotherapeutic option when treating patients with colorectal choriocarcinoma.",1,1,1,The paper focuses on a patient with colorectal cancer with choriocarcinoma differentiation.,The study examines the use of cetuximab as part of a combination treatment regimen.,The study describes the effect of cetuximab treatment in the context of a patient's response to therapy.
41344351,The lancet. Gastroenterology & hepatology,2026,Feb,,Glecirasib with or without cetuximab in previously treated locally advanced or metastatic colorectal cancer with KRAS,"Journal Article, Clinical Trial, Phase II, Clinical Trial, Phase I, Multicenter Study","Jian Li, Zhenghang Wang, Jing Huang, Yi Ba, Baoshan Cao, Suxia Luo, Wenhua Li, Chunmei Bai, Zhengbo Song, Jianping Xiong, Liangjun Zhu, Guangyu An, Yanqiao Zhang, Zhihua Li, Yongsheng Li, Yanhong Gu, Changlu Hu, Xingya Li, Chenghui Huang, Qihan Fu, Xianli Yin, Xinjun Liang, Diansheng Zhong, Huaqiu Shi, Xiaoyan Li, Zhen Li, Lian Liu, Feng Wang, Rong Liang, Guohao Xia, Zhen Wang, Andrea Wang-Gillam, Yuli Ding, Zhiyue Rao, Wenhui Pan, Shuang Lu, Xin Sun, Lin Shen","KRASG12C mutations are present in around 4% of patients with colorectal cancer and are associated with lower treatment response rates and overall survival. EGFR signalling has been identified as a primary mechanism of resistance to KRASG12C inhibitors. We aimed to evaluate the efficacy and safety of a novel, covalent, small molecule KRASG12C inhibitor, glecirasib (JAB-21822), as monotherapy or in combination with the anti-EGFR cetuximab, in patients with KRASG12C-mutated colorectal cancer.
JAB-21822-1002 was an open-label, non-randomised, dose escalation (phase 1) and expansion (phase 2a) trial evaluating glecirasib monotherapy in KRASG12C-mutated solid tumours. JAB-21822-1007 was an open-label, non-randomised, dose escalation (phase 1b) and expansion (phase 2) study evaluating glecirasib plus cetuximab in KRASG12C-mutated colorectal, small intestine, and appendiceal cancer. Adult participants (aged ≥18 years) were recruited in China from 17 hospitals for the monotherapy trial and 16 hospitals for the combination trial. Here, we report only on patients with colorectal cancer treated with oral glecirasib at the recommended phase 2 dose (800 mg once daily in 21-day treatment cycles [until disease progression, intolerable toxicity, investigator's discretion, or withdrawal of consent]), pooling phase 1 and 2 data together. In the combination trial, cetuximab was administered intravenously with an initial loading dose of 400 mg/m2 in the first week, followed by 250 mg/m2 every week or 500 mg/m2 every 2 weeks. For this analysis, key eligibility criteria were histologically or cytologically confirmed locally advanced or metastatic colorectal cancer with KRASG12C mutation; Eastern Cooperative Oncology Group performance status of 0 or 1; and at least one measurable lesion per Response Evaluation Criteria in Solid Tumors (RECIST). For phase 1 of both trials, patients must not have responded to, were not suitable for, or refused standard of care. For phase 2 of both trials, patients must have received at least first-line standard of care and had disease progression or intolerance. Primary endpoints for the monotherapy trial were safety (treatment-emergent adverse events, serious adverse events, treatment-related adverse events, dose-limiting toxicity, and clinically significant changes in vital signs, physical examination, and electrocardiography, and clinically significant unexpected laboratory values of grade ≥3) for phase 1 and objective response rate (complete and partial response) for phase 2a. Primary endpoints for the combination trial were dose-limiting toxicities, maximum tolerated dose, and recommended phase 2 dose for phase 1b and objective response rate for phase 2. The full analysis set was defined as patients with at least one measurable lesion at baseline who received at least one dose of glecirasib in the monotherapy trial, or at least one dose of glecirasib plus cetuximab in the combination trial. The safety analysis set was defined as patients who received at least one dose of glecirasib in the monotherapy trial, or at least one dose of glecirasib or cetuximab in the combination trial. The trials are registered with ClinicalTrials.gov (NCT05009329 and NCT05194995), and are active but no longer recruiting.
Between Oct 12, 2021, and Dec 4, 2023, 44 patients with colorectal cancer (27 male and 17 female) in the monotherapy trial received glecirasib 800 mg once daily and comprised the full analysis and safety analysis sets. Between Feb 17, 2022, and Feb 28, 2023, 47 patients with colorectal cancer (22 male and 25 female) in the combination trial received glecirasib 800 mg once daily plus cetuximab and comprised the safety analysis set. One patient was excluded from the full analysis set as they received glecirasib only. Data cutoff was June 30, 2024. Median follow-up was 21·9 months (IQR 20·0-25·5) in the monotherapy trial and 18·7 months (15·9-20·6) in the combination trial. In the monotherapy trial phase 1, 15 patients with colorectal cancer were enrolled. No dose-limiting toxicities, unexpected grade 3 or worse laboratory values, or changes in vital signs, physical examinations, or electrocardiography were observed. 15 (100%) patients had treatment-emergent adverse events (n=8 [53%] grade ≥3), 13 (87%) of 15 reported treatment-related adverse events (n=4 (27%) grade ≥3); five (33%) of 15 patients had serious treatment-emergent adverse events, none were treatment-related. In the combination trial phase 1b, six patients with colorectal cancer were enrolled. No dose-limiting toxicities were observed and the maximum tolerated dose was not reached. The recommended phase 2 dose was chosen as glecirasib 800 mg once daily. Objective response rate was 23% (95% CI 11-38; ten of 44 patients [ten partial responses]) in the monotherapy trial and 50% (35-65; 23 of 46 patients [23 partial responses]) in the combination trial. The most common treatment-related adverse events were anaemia (24 [55%]), blood bilirubin increased (23 [52%]), and conjugated bilirubin increased (17 [39%]) in the monotherapy trial, and rash (39 [83%]), blood bilirubin increased (29 [62%]), conjugated bilirubin increased (17 [36%]), alanine aminotransferase increased (16 [34%]), and anaemia (15 [32%]) in the combination trial. The incidence of grade 3 or 4 treatment-related adverse events was 20% (nine of 44) in the monotherapy trial and 19% (nine of 47) in the combination trial. Two (5%) of 44 patients in the monotherapy trial (febrile neutropenia, n=2) and four (9%) of 47 patients in the combination trial (interstitial lung disease [n=1], pleural effusion and pericardial effusion [n=1], pyrexia [n=1], and rash [n=1]) reported serious treatment-related adverse events. No treatment-related deaths were observed in either trial.
Glecirasib monotherapy and its combination with cetuximab represent potential treatment options for patients with advanced, refractory colorectal cancer harbouring KRASG12C mutations. The promising efficacy and safety support further exploration of glecirasib-based combinations in earlier lines of treatment.
Jacobio.
For the Mandarin translation of the abstract see Supplementary Materials section.",1,1,1,The study explicitly focuses on patients with colorectal cancer.,The study examines the use of cetuximab in combination with glecirasib as a treatment for colorectal cancer.,"The study describes the effect of cetuximab treatment, including adverse events and objective response rates in combination with glecirasib."
41490183,Journal of visualized experiments : JoVE,2025,Dec,19,A Case of Severe Skin Adverse Reactions Caused by Cetuximab.,"Journal Article, Case Reports, Video-Audio Media","Ya-Ting Yan, Cai-Hong Jiang, Li Wang, Yi-Xuan Niu, Gang Chen, Zi-Juan Liu","Cetuximab, a monoclonal antibody targeting the epidermal growth factor receptor (EGFR), is associated with various adverse reactions, among which skin-related adverse events (AEs) are common. This case report details a patient who developed severe skin AEs after cetuximab administration and outlines a reproducible management protocol. The patient, a 44-year-old man with KRAS wild-type metastatic rectal cancer, was undergoing cetuximab-based chemotherapy. Approximately 10 days after initiating a cetuximab monotherapy cycle following prior combination regimens, he developed severe Grade 3-4 acneiform rash and erythema multiforme-like lesions with ulceration, exudation, crusting, scaling, and hyperpigmentation on the face and anterior chest. Evaluation included physical examination, dermatology consultation, skin biopsy for histopathology and direct immunofluorescence, and laboratory tests (including serum IgE, eosinophil count, C-reactive protein, HLA-A*31:01 genotyping, viral serologies, and bacterial cultures). Management involved permanent discontinuation of cetuximab, high-dose intravenous methylprednisolone (1.5 mg∙kg-1∙day-1), cyclosporine (3 mg∙kg-1∙day-1), supportive wound care in a burn unit, and topical ocular/oral care. Symptoms improved significantly within 72 h, with a 90% reduction in lesion severity by day 14. Therapy was successfully transitioned to bevacizumab plus FOLFOX after dermatologic recovery, with no rash recurrence during follow-up. This case highlights the importance of early recognition, multidisciplinary management, and protocol-driven intervention for severe cetuximab-induced skin toxicity to ensure patient safety and treatment continuity.",1,1,1,"The paper describes a patient with metastatic rectal cancer, which is a type of colorectal cancer.","The paper examines the use of cetuximab in a patient undergoing treatment, including its associated adverse effects.","The paper describes the effect of cetuximab treatment, specifically the severe skin adverse reactions it caused in the patient."
41135735,European journal of pharmacology,2025,Nov,15,Postmarketing safety signals of cetuximab and panitumumab in the FAERS database: Real-World insights focus on population heterogeneity.,Journal Article,"Kai-Li Mao, Liang-Yan Jin, Guo-Quan Chen, Jun Xie, Ping Chen, Hua-Yu Sun, Liu-Cheng Li, Hong-Liang Zheng","Anti-epidermal growth factor receptor monoclonal antibodies like cetuximab and panitumumab have revolutionized colorectal cancer therapy, but their benefits are offset by limiting toxicities that require precise prevention strategies.
We interrogated the FDA Adverse Event Reporting System (2004 Q1-2025 Q2) to map agent-specific toxicity signatures across age, sex and reporter strata under a multi-algorithm disproportionality framework. Four convergent metrics were required to declare a signal; demographic modifiers (age and sex) and reporter lens (medical vs non-medical personnel) were integrated.
20920 cetuximab and 10280 panitumumab reports with single primary suspect status were identified. Cetuximab generated an early, age-independent AE burst: 54.4 % of events arose within 30 days. Panitumumab showed a protracted profile with only 40.8 % of events in the first month yet 5.4 % reported after one year versus 2.7 % for cetuximab. Panitumumab carried a higher fatality rate and disproportionately intense cutaneous signals, whereas cetuximab dominated radiation-synergy domains such as radiation skin injury. Age stratification revealed ≥65-year panitumumab users faced a 1.5-fold higher hypomagnesaemia ROR than younger patients; women reported higher dermatitis acneiform ROR values on panitumumab compared with cetuximab. Non-medical reporters amplified cetuximab radiation mucositis ROR to 3374.22, whereas panitumumab skin-toxicity ROR climbed to 958.54.
Cetuximab and panitumumab exhibit divergent, demography-modulated safety narratives. Cetuximab amplifies acute radio-toxicity whereas panitumumab elicits a quantitatively stronger, more persistent mucocutaneous and electrolyte injury that is magnified by female sex, advancing age, and non-medical reporters reporting. These population-specific pharmacovigilance signatures refine risk-benefit assessments and should inform individualized monitoring strategies in precision oncology.",1,1,1,The paper explicitly mentions patients with colorectal cancer undergoing treatment with cetuximab.,The study examines the use and safety profile of cetuximab in the context of colorectal cancer treatment.,"The paper describes the effects of cetuximab treatment, including adverse events and toxicity patterns."
41646214,ESMO real world data and digital oncology,2025,Sep,,Real-world characteristics and outcomes of patients with BRAF,Journal Article,"N Hitchen, H-L Wong, R Wong, J Shapiro, M Burge, L Nott, B Lee, S H Lim, S F Wong, S Caird, V Wong, N Rainey, A Khattak, H Mandaliya, T Hayes, J Torres, A Jalali, A Campbell, P Gibbs, J Tie","BRAFV600E-mutated metastatic colorectal cancer (mCRC) is a biologically distinct and clinically aggressive subtype associated with poor outcomes. Real-world data on this population remains limited, particularly within the Australian health care setting.
The COALA study is a national, prospective registry-based observational analysis of patients with mCRC across 21 Australian institutions. Data were extracted from the Treatment of Recurrent and Advanced Colorectal Cancer (TRACC) and TRACC-Select registries and included demographics, molecular profiles, treatment patterns and overall survival (OS). Uptake and impact of encorafenib plus cetuximab (EC), since being available in Australia from May 2019, were examined.
Of 2976 patients tested for BRAF, 374 (13%) harboured BRAFV600E mutations, including 53 (24%) of the 217 'very-young' subset (<40 years of age). Overall, compared with wild-type (BRAF-wt) tumours, BRAFV600E-mutated tumours were more likely to occur in females (55% versus 39%), and right-sided primaries (60% versus 28%) occur with deficient mismatch repair (dMMR) (24% versus 3%), and/or peritoneal metastases (36% versus 20%). Only 42% of BRAFV600E patients received second-line (2L) treatment. OS was significantly shorter in BRAFV600E versus BRAF-wt patients [hazard ratio (HR) 1.75, 95% confidence interval 1.5-2; median 16.6 versus 32.3 months]. Among BRAFV600E patients receiving 2L therapy, EC use versus chemotherapy was associated with a trend for improved OS (HR 0.70, median 8.6 versus 6.8 months).
The COALA study provides the first Australian real-world profile of BRAFV600E-mutated mCRC. These findings underscore the importance of early and effective therapeutic strategies, and identify a novel, disproportionately affected very-young subgroup requiring targeted research and clinical focus.",1,1,1,The study focuses on patients with metastatic colorectal cancer (mCRC).,The study examines the use of Cetuximab in combination with Encorafenib (EC) as a treatment for BRAFV600E-mutated mCRC.,"The study describes the effect of Cetuximab treatment in combination with Encorafenib, showing a trend for improved overall survival compared to chemotherapy."
40624314,Oncogene,2025,Sep,,ALKBH5 suppresses m,Journal Article,"Hu Han, Yan Li, Zhiyi Lin, Xiaoping Ma, Wukui Huang, Cengceng Lu, Rongyan Ma, Rui Han","Colorectal cancer (CRC) is a severe health risk, and while Cetuximab is a key treatment, resistance due to KRAS mutations poses a challenge. The role of ALKBH5, often overexpressed in cancers, in KRAS-mutated CRC and its resistance to Cetuximab is not yet fully understood. This research initiates an inquiry from both cellular and animal experimental perspectives, investigating the potential of ALKBH5 to confer resistance to Cetuximab in colorectal cancer cells harboring KRAS mutations. We investigated ALKBH5 expression in clinical samples of CRC with varying responses to Cetuximab and KRAS statuses. Drug-resistant cell lines were developed using incremental drug concentrations, and the effects of ALKBH5 modulation on cell viability and proliferation were assessed using CCK-8 and clonogenic assays. The in vivo impact of ALKBH5 on drug resistance in KRAS-mutant cells was explored. Transcriptome sequencing of ALKBH5 knockdown cells pinpointed genes linked to Cetuximab resistance. We also examined ALKBH5's regulation of FOXM1 m6A methylation with dual-luciferase and MeRIP assays and conducted FOXM1 functional reversal studies, alongside Western blot analysis of Wnt/β-catenin pathway proteins. Elevated ALKBH5 expression is positively correlated with Cetuximab resistance in KRAS-mutant CRC. ALKBH5 confers Cetuximab resistance to CRC cells in a KRAS-mutation-dependent manner in vitro and in vivo. ALKBH5 regulates FOXM1 expression through m6A demethylation, and FOXM1 can reverse Cetuximab resistance in ALKBH5-modulated KRAS-mutated CRC cells. Additionally, FOXM1 influences the sensitivity of KRAS-mutant tumors to Cetuximab by regulating the Wnt/β-catenin pathway. ALKBH5 plays a crucial role in the resistance of KRAS-mutant CRC to Cetuximab by inhibiting the m6A RNA methylation of FOXM1 and suppressing the activation of the Wnt/β-catenin signaling pathway.",1,1,1,"The study explicitly focuses on colorectal cancer (CRC) cells, particularly those with KRAS mutations.","The study examines the effect of Cetuximab on CRC cells, including the development of drug resistance.","The study describes the effect of Cetuximab treatment, including its resistance in KRAS-mutant CRC cells and the role of ALKBH5 in modulating this resistance."
